,name,review
0,Angry Birds Rio, 와 너무 추억인데 게임이 변한 게 없어서 진짜 좋았다
1,Angry Birds Rio, 중독성
2,Angry Birds Rio, 재미이는 디 요새로운 것 좀 넣어서 하쇼. 근데 광고없으면안되남?업데이좀하슈
3,Angry Birds Rio, 똥 뱃살 싸지 마
4,Angry Birds Rio, 좋아요ㅎㅎ
5,Angry Birds Rio, 최고의 추억 팔이(그래픽이 바뀌었군...)
6,Angry Birds Rio, Good
7,Angry Birds Rio, 크 언제 해도 재미있는 추억의 게임 앵그리버드 다께서 스타워즈 해보려고요 ᄏᄏᄏ
8,Angry Birds Rio, 서정하가 많이 좋아했던 앵그리버드
9,Angry Birds Rio, 이세이  님  어이없음. 난  광고  하니도  않나 오더    만. 님  이  게임을  못해서  그러겠지. 난  재미만  있음.ㅋ   다른  종류  게임들이  많아서  좋음. 정말  짱짱  최고의  게임.!
10,Angry Birds Rio, 아니 여기 초등학생들 다 아무 말 잔치해놨네ᄏᄏᄏᄎᄏ애니메이션 만드는 게 죄냐 링 여기 있는 초등학생들 선이 짓 개오 지네
11,Angry Birds Rio, ㅇㅎ초초아콘ㄹㅋㅎ톦오어오촡ㅎ
12,Angry Birds Rio, 이 게임이 모든 앵그리버드가 원숭이나 새를 물리치는 게임!
13,Angry Birds Rio, 역시 앵그리버드 제가 맨 처음에 했던 게임입니다
14,Angry Birds Rio, 이 게임을 지웠다 설치하기 벌써 10번째 너무 좋은 게임
15,Angry Birds Rio, 시간 때울 때 최고다 응원해요
16,Angry Birds Rio, 각도만 잘 맞추면 재밌는 게임
17,Angry Birds Rio, 광고는 5초 안에 스킵 하게 해주세요~
18,Angry Birds Rio, 지웠다가 다시 깔았습니다ᄏ중독성 최고!
19,Angry Birds Rio, 광고 안 나오게 하는 방법 와이파이 끄면 돼요
20,Angry Birds Rio, 앵그리버드 완전 많이 했던 게임인데 이것도 정말 재밌어요😃
21,Angry Birds Rio, 짜릿 타니까요
22,Angry Birds Rio, 진짜 대박 재밌어 요
23,Angry Birds Rio, 너무 재미있어요.😇☺😀
24,Angry Birds Rio, !!!!!!!!!!!!!!!!!!!! •••••
25,Angry Birds Rio, 와우
26,Angry Birds Rio, 개굴잰
27,Angry Birds Rio, 너무 좋아요
28,Angry Birds Rio, 좋아요
29,Angry Birds Rio, 정말 좋
30,Angry Birds Rio, 🍯잼
31,Angry Birds Rio, 꿀 잼♥♥
32,Angry Birds Rio, 제작자님 너무하시네 게임이 아니라 예술작품을 만들고 있어...
33,Angry Birds Rio, 유저들아 광고 어쩔 수 없는 거예요 손에 익 분기점 챙기려면 설명해줘도 모를 거 같지만 그런 게 있음
34,Angry Birds Rio, 이  게임  제가  해본  건데   재미는   있어요
35,Angry Birds Rio,광고 나온다고 하시는 분들 와이파이 끄고 하시면 될 것을 왜 자기가 먼저 못하고 왜 제작자한테 욕을 합니까? 제작자도 먹고살아야 합니다. 님들이 게임을 만들었는데 모두 무료로 쓰면 무슨 이익이 있겠습니까? 아무리 나이가 어리신 분들도 그 정도 생각은 하실 수 있을 것 아닙니까.... 그리고 이렇게 한글로 욕하고 광고 없애달라고 해도 로비오 엔터테인먼트는 핀란드 회사이기 때문에 영어로 쓰지 않는 이상 못 알아듣습니다. 제발 욕 좀 그만 이십시오
36,Angry Birds Rio,종비래드가있어쓰면좋캐써요 려롱로너어겨먼몬ㄴㅎ노노노노돌도고노고오도옥
37,Angry Birds Rio,와우!! WOW!! 옛날에 했던 앵그리버드가 생각나는 계기였네요! 제작자 짱입니다!
38,Angry Birds Rio, 옛날에 유행했던 거라서 사실 기대가 많이 없었는데 다시 해보니 재미있네요!
39,Angry Birds Rio,짱 정말 재밌어요 근대 광고 나오신다는 분들 그냥 와이파이 꺼놓고 하면 되잖아요 암튼 최고예요
40,Angry Birds Rio,최고! 흥미진진하고 스릴감이 좀 있네요! 암튼 좋아요!
41,Angry Birds Rio,광고 포함이라 나와있는 앱을 받아놓고서는 광고 타령하는 건가
42,Angry Birds Rio, 나 앵그리버드 마니아 진심으로 이거 젬있다
43,Angry Birds Rio,최고 제가 오랜만에 앵그리버드 하는데  재미있어요!!
44,Angry Birds Rio,스릴감 최고! 다시 해 보니 재미있네요 완전!
45,Angry Birds Rio,최고!!! 근데............................. 약간........... 좀................. 말할 수 없는................ 게................ 있어요..!!........ 실망 받으실 수 있어요
46,Angry Birds Rio,좋아요!! 제 친구들이랑 하는데 자꾸만 하고 싶어지는 게임이에요!
47,Angry Birds Rio, 이 게임 욕하지 마세요
48,Angry Birds Rio, 리오 나오기 전부터 나온 게 잴 재밌어요. 원조를 원해요.
49,Angry Birds Rio,오랜만에 하니 재미는 있음 제 곧 내
50,Angry Birds Rio,앵그리 버그 정말 재밌음
51,Angry Birds Rio, 크킂ㄱㄹ저ㅛㅛㅓㅈㅊ
52,Angry Birds Rio,김도헌 안녕 난 도헌이야
53,Angry Birds Rio, 심심풀이에 딱!
54,Angry Birds Rio, 정말로 최고의 게임!
55,Angry Birds Rio, 짱
56,Angry Birds Rio, 오오오오 옹옹
57,Angry Birds Rio,안 그리 재미있는 거라서
58,Angry Birds Rio,굿 굿굿
59,Angry Birds Rio, 브금 정말 좋아요♡
60,Angry Birds Rio, 짱
61,Angry Birds Rio,굿 굿
62,Angry Birds Rio, 끝내줘요
63,Angry Birds Rio,짱 짱짱짱짱짱짱짱짱짱짱짱짱짱짱짱짱짱짱짱짱짱짱짱짱짱짱짱짱짱짱짱짱짱짱짱짱짱짱짱짱짱짱짱짱짱짱짱짱짱짱짱짱짱짱짱짱짱짱짱짱ㅇㅈ??
64,Angry Birds Rio,굿 굿
65,Angry Birds Rio,광고를 보여주는 목적은 돈을 벌기 위해서 임 광고 타령 처하지 말고 곱게 게임해라 너희들이 게임 쳐만드세요 꼬우 면 ㅋㅋㅋㅋㅋ
66,Angry Birds Rio,그럴 거면 게임 전체를 하지 마 장은숙 진짜 노 답이네 제작자도 돈 벌어야 될 거 아니야 광고 처 뜬다고 진짜 왜 욕질이냐
67,Angry Birds Rio,재밌어요^^되게 웃기고 파란색 새가 귀엽더라고요 이 게임 추천해요
68,Angry Birds Rio, 무료니까 광고  많은 건 어쩔 수 없다.  그럼 게임회사는 돈 벌지 말라는 거임?
69,Angry Birds Rio,"Good Yeah, Its really fun. Bc I can play this game without bounch of boxs if I just watch ads."
70,Angry Birds Rio,꿀 팁/광고 뜨는 거 해결법 데이터나 와이파이를 끄시면 광고가 안 나옵니다.  ㅎㅎ광고는 인터넷과 연결돼 있을 때만 나옵니다.
71,Angry Birds Rio,재밌네요 삭제했지만  또 하고 싶ㅇ서 다시 다운로드함
72,Angry Birds Rio,앵글리아 버드 옛날에 타임 말로 잘했는데 김 형사 충성!
73,Angry Birds Rio,새들이 튕겨져 나갈 때 귀여워요. 넘나 귀여움 광고도 안 나와요. 신기하네요.
74,Angry Birds Rio,리오 리오가 애그리 버드 중 제일 재미있어요
75,Angry Birds Rio,재밋 근데 원숭이보다 돼지가 더 귀여워요
76,Angry Birds Rio,이게 최고임 앵그리버드 종류 중에서 이게 제일 재밌어요:-)
77,Angry Birds Rio,광고 싫음 인터넷 꺼놓고 해 라미... 바보들... ㅎ 재미만 좋아요... ㅎ
78,Angry Birds Rio,핵꿀잼 아 밤처럼 화날 때 터졌으면
79,Angry Birds Rio,안녕 ㅣ눅 ㄴㄱᆞㄷㄴ듭ㄴㄷsy6zziddduufiktkgidudyysyudd7ddddxxusd8iuddiidxlyppr86huzxudifusgyjusjrioe75uyodhatifjys9rrubxgt7bl
80,Angry Birds Rio,굿ᆢ!! 재미나요
81,Angry Birds Rio,앵그리버드 리오 재미있음
82,Angry Birds Rio,5년 5년째 즐기고 있네요
83,Angry Birds Rio,재밌긴 한데......... 제작가님!!!! 구글 광고 좀 줄여주세요
84,Angry Birds Rio,중독쩜 재밌네
85,Angry Birds Rio," 앵그리 버드, 최고"
86,Angry Birds Rio,최고예요 엄청나게 재밌어요
87,Angry Birds Rio,This game is from HEII. Sorry~^^
88,Angry Birds Rio,Good to feel the past Good
89,Angry Birds Rio,최고 이 사람 최고 아냐? 광고가 너무 많아요
90,Angry Birds Rio,나이스 핵잼
91,Angry Birds Rio, 와 진짜 꿀 잼 정말 지림
92,Angry Birds Rio,재밌음 새가 귀엽고 재밌어요
93,Angry Birds Rio, 너무 좋네
94,Angry Birds Rio,굿! 정말 죔죔!😊
95,Angry Birds Rio,b b
96,Angry Birds Rio,굿 재밌어요
97,Angry Birds Rio, 최고 내요!!!!
98,Angry Birds Rio,짱 짱
99,Angry Birds Rio,굳 굳
100,Angry Birds Rio,재미 재미
101,Angry Birds Rio,굿 굿
102,Angry Birds Rio,재미 재미
103,Angry Birds Rio,앵그리버드 정말 재밌어요. 진~~~~~~~~~~~~~~~~~~~~~~~~~~~짜 재밌어요
104,Angry Birds Rio,나이젤이 배신자다?! 배신하면 절대로 안 돼.
105,Angry Birds Rio,와 팔 필요 없고 꿀 잼 광고도 없고 와파 필요 없는 꿀 잼☜♡
106,Angry Birds Rio,역시 재미나요 설명 필요 없음
107,Angry Birds Rio,게임 중 최고 이건 불편한 점 없는 완벽 게임   까는 거는 강추!!!
108,Angry Birds Rio, 제밌네요ㅎㅎ
109,Angry Birds Rio,ㅎ 해봐요
110,Angry Birds Rio, 님들 이걸 왜 욕함? 좋구먼 님들 폰에 이상이 있지 않는 한 그럴 리 없음 내포 똥인데 겁나 잘 됨. 끝으로 제작자님께 감사 말씀을..  재밌는 게임 만들어 주셔서 감사합니다
111,Angry Birds Rio,재미짐 불평하지 말고 하삼
112,Angry Birds Rio," 제작자님 이런 게임 만들어 주셔서 감사하고요, 힘내세요!"
113,Angry Birds Rio,앵그리버드 너무 재미있고 즐겁고 또 하고 싶네요 그래서 앵그리버드가 좋아요 다운로드하길 제가 잘 해서 앵그리버드 게임 짱 다음에는 앵그리버드 게임 더 재미있는 거 다운 받을게요
114,Angry Birds Rio,앵그리버드 리오 어이없이 실패하긴 하지만 하면 재미있음
115,Angry Birds Rio,장난 아니네 꿀 잼입니다. 완전 재미있어요
116,Angry Birds Rio, 이 게임을 욕하지 마세요
117,Angry Birds Rio, 와이파이 끄면 광고 안 뜸
118,Angry Birds Rio,Angry birds rio Good
119,Angry Birds Rio,폰 문제임 폰이 안 좋으면 안 좋을수록 좋음
120,Angry Birds Rio,역시.. 재미있어요
121,Angry Birds Rio,고 잠뜰
122,Angry Birds Rio,최고예요! 정말 정말 재밌어요!!
123,Angry Birds Rio,최고!  짱! 정말 실감 나고 대빸 재미있어요. 최고!!!!!!!!!!!!
124,Angry Birds Rio,최고 진짜 좋아요
125,Angry Birds Rio, 꿀 잼
126,Angry Birds Rio,좋아요 게임이 재밌어요*^^*
127,Angry Birds Rio, 굿
128,Angry Birds Rio,굿 굿
129,Angry Birds Rio,IT'S VERY FUN!! 시간 가는 줄 모른다네요~ ㅎㅎㅎ 알을 구출하러 녹색돼지들과 방해요소를 처치하고 3스타를 얻기 위해 오늘도 고군분투!!
130,Angry Birds Rio,ㅋㅋㅋ 업그레이드 많이 하넼 이거 안 한 지 3년 댐.. ㅎ
131,Angry Birds Rio,꿀잼ㅋㅋ 개임 데이터 필요하고 한 것도 없는데 이건 재밌네ᄏ
132,Angry Birds Rio,업글 많이 했구나... 4년 동안 안 하고 뭐지
133,Angry Birds Rio, 5난이 넘은 게임인가? 어떻게 보면 추억 게임.
134,Angry Birds Rio, 이건 뭐 질리지도 않니? ㅋㅋ          짱
135,Angry Birds Rio,굳 굳굳
136,Angry Birds Rio,역시 꿀 잼~ 재미나네요~
137,Angry Birds Rio,재미있다 옛날 추억 게임이다. 중학 생지만  지루하지 않다
138,Angry Birds Rio,앵그리버드 ㅋㅋ완전재미있음
139,Angry Birds Rio,꿀 잼 와우 진짜 재밌어요
140,Angry Birds Rio,앵그리버드  리오 베리베리  굿
141,Angry Birds Rio,꿀 잼 엄청나게 재미있어요 특히 새떼가 나올 때가
142,Angry Birds Rio, 옛날보다 업그레이드가 많이 돼서 재밌네요~~~
143,Angry Birds Rio, 재밌네요.
144,Angry Birds Rio,음악 보옥
145,Angry Birds Rio,리오 정글
146,Angry Birds Rio,해 재미 이거 진짜 재미있네
147,Angry Birds Rio,꿀 잼 핵 꿀 잼이에요!  대박
148,Angry Birds Rio,너 너 논
149,Angry Birds Rio,좋아 좋아요
150,Angry Birds Rio,재밌댸--------- ㅋㅋㅋ ㄲㄲ
151,Angry Birds Rio,짱짱 최고입니다
152,Angry Birds Rio,굿 재미있요
153,Angry Birds Rio,꿀 잼 꿀 잼
154,Angry Birds Rio, 재밌네
155,Angry Birds Rio,귯 굿
156,Angry Birds Rio,좋아요 좋아좋아
157,Angry Birds Rio, 굿
158,Angry Birds Rio,👍 엄지 척~~~~~^^
159,Angry Birds Rio, 굿
160,Angry Birds Rio,정말 다이내믹한 앵그리버드 상당히 재밌네요. 맵도 예쁘고 전개 방식도 원작보다 훨씬 다이내믹 합니다. 다만 광고가 너무 많이 나와서 짜증이 나요;;
161,Angry Birds Rio, 요즘은 잘 안 하지만 예전엔 정말 재미있게 했었네요. 업데이트도 됐는데 다시 시작해볼까 생각 중입니다.
162,Angry Birds Rio," 예전에 엔딩 보고 이젠 아예 안 해서 지웠는데, 얼마 후 스테이지가 추가되다니... 처음부터 다시 시작해야 됨. 젠장..."
163,Angry Birds Rio,환불 부탁드립니다 조카 녀석이 저도  모르게  8000원짜리 아이템을  구매했습니다   환불해 주세요
164,Angry Birds Rio," 어렸을 때.... 재미게 하던 게임!!!! 다시 보내요. 그동한 찾다, 찾다, 지금 찾았네요.ㅋ"
165,Angry Birds Rio,어려워 ㅜㅠ 이것도 현질해야 하나 ㅋ
166,Angry Birds Rio,아주 좋음 굳
167,Angry Birds Rio,최고! 진짜재미있는데.........광고만좀빼주세요ㅠㅠ
168,Angry Birds Rio,와우 블루는 떼거지네?
169,Angry Birds Rio,앵그리버드 리오에서 가친 새들을 구하는 게임
170,Angry Birds Rio,굿굿 졸잼 ㅋㅅㅎ
171,Angry Birds Rio, 재미있어요
172,Angry Birds Rio,앵그리버드 짱
173,Angry Birds Rio,이건 완전 재미 장 쉽
174,Angry Birds Rio,최고!^^ 재미있어요!^^
175,Angry Birds Rio, 재밌어요
176,Angry Birds Rio,정말 좋아요 정말 좋아요
177,Angry Birds Rio,굳 굳
178,Angry Birds Rio, 강추
179,Angry Birds Rio,욕하지 마세요 만든 사람은 뭐가 됨. 누구는 힘들게 만들었는데 플레이밖에 안 하는 사람들이 자기 조금 불편하다고 제작자한테 화내면 제작자는 뭐가 됨? 게임 재미있으면 됐지 광고 뜬다고 화내는 건 뭐임? 다른 사람들이 와파 끄고 하면 된다고 하는데도 무시하고 화를 왜 냄? 님들아 착하게 삽시다
180,Angry Birds Rio,광고 없애는 방법 있음. 광고 때문에 짜증 나는 님들아. 와이파이하고 데이터 끄면 광고 안 나옴
181,Angry Birds Rio,이 게임 싫으면 안 하면 되잖아 이 사람들 뭐냐? 인간도 아님 아놔 아니 조금 좋은 조언이라도 해줘야지 자기들  화나면 화풀이 상대가 제작자인가? 아.... 어이없다 진짜
182,Angry Birds Rio,광고 없애달라는 놈들아 그럼 제작자들은 뭘로 돈 벌라고? 돈을 내고 다운로드하는 것도 아니고 현질 유도도 안 하는데 그 대신 광고 몇 초 보기가 그렇게 싫냐? 광고가 보기 싫으면 인터넷 연결을 끊고 플레이하다던가 괜히 여기 와서 평점 테러하지 말고
183,Angry Birds Rio,욕 한 사람 욕하지 마세요 제작자 생각하세요 욕 한 분들 욕하려면 게임을 직접 만들어하면 되잖아
184,Angry Birds Rio,님들 님들 게임 재밌는데  왜 그럼? 광고 싫다면 게임하지 마세요. 왜 여기 와서 화풀이야?
185,Angry Birds Rio,광고 없애라고? 장난하세요? 그 광고 보기가 그렇기 싫으시면 그냥 하지 마세요
186,Angry Birds Rio, 욕하지 마요 자기들은 이런 게임도 못 만들면서
187,Angry Birds Rio,님들아 야 광고 없으면 제작자 뭐 먹고 사
188,Angry Birds Rio,앵그리버드 리뷰 어렵긴 하지만   신기하고 재밌어요.
189,Angry Birds Rio,추억 추억 돋아서 깔았는데 여전히 재미있네ᄒᄉᄒ
190,Angry Birds Rio,난 인도 광고 아 진짜 게임하라는 16야
191,Angry Birds Rio,데이터를 꺼.... 그럼 광고 안 나와 이 친구들아
192,Angry Birds Rio,전쟁 카카오 연계된 거보다 이게 더 좋음 광고 많긴 하지만 현질 유도도 없고 제작자도 먹고살아야 하는 게 당연한 건데.....
193,Angry Birds Rio,재밌음 광고가 짜증 나요 근데
194,Angry Birds Rio, 와우 광고도 안 뜨고 이 게임이 아 완전 (왕잼 꿀 잼 ) 여러분들 모두 이 게임 다운로드 하세요~^^
195,Angry Birds Rio, 다시 찾은 아구리 ㅋ
196,Angry Birds Rio,난 머 쉬워요 그냥 제밌어뇨
197,Angry Birds Rio,굿 ㅋ
198,Angry Birds Rio,설치가 느림 그래도 꿀 잼!!!!!!!
199,Angry Birds Rio,헝그리 버드는 없나요? ㅋ
200,Angry Birds Rio,저기 님들아..... 광고 없으면 제작자 수입이 별로 없어요.....
201,Angry Birds Rio,현 덤더보보머모더거노더노네도데
202,Angry Birds Rio,진짜 좋아요 좋다는 말밖에 못 하겠네요 Good!
203,Angry Birds Rio,재밎지라 전이 게재 및 어서 꿀 잼
204,Angry Birds Rio, 초창기 한동안 했는데 재밌네요
205,Angry Birds Rio, Wow very good!
206,Angry Birds Rio,재미있긴 한데... 레벨이 너무 적음
207,Angry Birds Rio,재밌음 시리즈 중에 젤 재밌음
208,Angry Birds Rio, 진짜좋아욬ㅋㅋㅋ
209,Angry Birds Rio,앵그리버드 꿀 잼
210,Angry Birds Rio,잼잼잼 잼잼잼꿀잼잼잼
211,Angry Birds Rio,재밌어요 앵그리버드 할수록 빠져드네요
212,Angry Birds Rio, 너무 재밌어요~
213,Angry Birds Rio,다시 하니 재밌다♥♥ 다른 온라인게임 말고 이걸 다시 하니 잼♥♥
214,Angry Birds Rio,짱!! 진짜 재미있어요~~
215,Angry Birds Rio,짱 bb
216,Angry Birds Rio,앵그리버드 리오 앵그리 버드리 오투 재밌다
217,Angry Birds Rio,최고 설치 속도 와쩔어
218,Angry Birds Rio,굿굿굿 쌀아 있네 예
219,Angry Birds Rio,good 아주 재밌다!
220,Angry Birds Rio, 정말 좋아요. 짱짱짱!
221,Angry Birds Rio,사랑해 사랑해 사랑해 사랑해 사랑해 사랑해 사랑해 사랑해 사랑해 사랑해 사랑해 사랑해 사랑해 인피니트 사랑해 사랑해 사랑해 인피니트 사랑해
222,Angry Birds Rio, 이거
223,Angry Birds Rio, 꿀 잼
224,Angry Birds Rio,Good Good
225,Angry Birds Rio, 넘넘 좋아요^^~~♥♥♥♥♥
226,Angry Birds Rio, 완~~~~~~~~~~~전 굳굳!!!!!!!!!!
227,Angry Birds Rio, 최고
228,Angry Birds Rio, 좋아요
229,Angry Birds Rio,좋아 좋아
230,Angry Birds Rio,굿 굿
231,Angry Birds Rio,최고 최고
232,Angry Birds Rio,이정현 많아지는 것 짱임
233,Angry Birds Rio,역시~~!!! 명불허전  앵그리버드 중독됐어요
234,Angry Birds Rio,재미나요 재미나다 재미나
235,Angry Birds Rio,진짜 추천 시간 가는 줄 모르겠음
236,Angry Birds Rio,Good Good!!
237,Angry Birds Rio,와 와우
238,Angry Birds Rio,Good Goooooooooooooood
239,Angry Birds Rio, 역시 재밌다
240,Angry Birds Rio,굳 굳
241,Angry Birds Rio,좋아요 좋아요
242,Angry Birds Rio,이것만 재밌다 이런 게임은 어느 게임과도 비교할 수 없다. 와이파이가 필요 없이도 할 수 있으니 직장까지 가기 전 미션 클리어!!!
243,Angry Birds Rio,다른 게임과는 아주 다르게 아주 꿀 잼이군 아니 제가 스타워즈도 했지만 이거와는 비교도 안 되게 완전 재밌음 결론은 완전 꿀 잼이니 많이들 하삼 아참 그리고 너무 재밌어 댓글 완전 많이 단 거임 원래 이렇게 겁나 많이 안 담 그럼 많이 사랑해주시길 그 이름 바로~~~~~~~~~~~~~앵그리버드
244,Angry Birds Rio,진짜로 진짜 제가 게임에 관심이 별로 없는데 이건 정말 잼 있어요! 추천! 별 5개 더 주고 싶어요! 재밌게 잘할게요
245,Angry Birds Rio,완전 재미 넘치네요 왜 게임을 이렇게 중독되게 만드는 거죠 너무 재밌네요
246,Angry Birds Rio,"재밌네ᄏ 초창기 때 생각도 나고ᄏ스마트폰 없어서 회사 동료, 친구 폰으로 했었던.. ㅋ"
247,Angry Birds Rio,엄청 재밌었다 새들도 늘고 다른 앵그리버드하고는 비교도 안 된
248,Angry Birds Rio,정건의 리뷰 아주 재밌음 근데 레벨이 너무 맜아요 그거 말곤 다 짱임
249,Angry Birds Rio,말할 수 없어! 이 게임은 말로 표현 못 할 만큼 꿀 잼
250,Angry Birds Rio,안녕 서우 분 중 하나인 것 같아 메일 보냅니다 수 있는 기회를 갖게 된 남자 자유형 수 있도록 하겠습니다 수 있는 기회가 되려 것 같습니다 수 있다 하더라도 그중 하나가 되었다. 그 결과 보고 싶은 마음이 더 많이. .. 이 같은 내용의 글을 게재했다. 이어 이 대통령은 이어 이 대통령은 또 다른 관계자는 전했다.
251,Angry Birds Rio,최고랍니다. 즐ᄅ게임 다채로워져서. 지루하지. 않아요.
252,Angry Birds Rio,역시로 비 오 정말이지 팬들이 뭘 원하는지 제대로 파악하는 게임회사
253,Angry Birds Rio,짱 말이 필요 없는 게임 별 무한개 주고 싶다
254,Angry Birds Rio,우와~ 전 요즘 이 게임에 푹 빠졌어요 이거 초기에 나왔던 걸로 아는데 원조도 상당히 재미있네요~
255,Angry Birds Rio, 재밌다 스타워즈나 밀만 모드는 갈라
256,Angry Birds Rio,아주 좋다 이런 전설의 게임을 어떻게 설명하지
257,Angry Birds Rio,진짜재밋임ㄷㄷㄷ임 진따노잼이라고하면진짜안됌
258,Angry Birds Rio,ㅋㅋㅋ 오랜만에 다시 하니 재미나네요 ᄏᄏ
259,Angry Birds Rio,느하하ㅏ하하하하하하 리오도 잘 만들었던데 앵그리버드랑 합치니까 오짐 와 마
260,Angry Birds Rio,갓 리오 3 만들어주세요ᄏ
261,Angry Birds Rio," 리오라는 영화를 봤는데 재밌고, 내가 제일 좋아하는 동물인 앵무새가 나오고, 너무 재밌음^^♥"
262,Angry Birds Rio,용량ㄷㄷ 왜 이리 많아ᅲᅲ
263,Angry Birds Rio,앵그리버드 최고 게임 아주재미있어서설명을봇하겠어요
264,Angry Birds Rio,재밌다 다른 건 다 와 팔 필요한데 이건 차원이 달라
265,Angry Birds Rio,아 역시 정말 엄청난 고화질과 귀여운 새들까지..... 멋집니다 잘 만들었네요
266,Angry Birds Rio,전설의 게임 영웅은 나오지만 돌아가면 다시 돌아오지 않습니다 영웅 중에 영웅
267,Angry Birds Rio,좋아 이 게임 데이터도 안 써도 되고 또 재미있기까지 하네요 재미나요 짱
268,Angry Birds Rio,두 번 말할 필요가.. 그냥 굳
269,Angry Birds Rio,말이 필요 없는 정말 감동
270,Angry Birds Rio,말이 필요 없는 게임 ANGRY BIRD RIO 최고!!!!~
271,Angry Birds Rio,블랙마켓 플레이 스토어보다 더 좋은 유료도 무료로 다운 밭는 더 좋은 블랙마켓입니다
272,Angry Birds Rio,It a very good game 이 게임은 오디에도 없는 전설 의의 게임입니다.
273,Angry Birds Rio,전설 게임이네 꿀 잼이네
274,Angry Birds Rio,ㅋㅋ 래ㅕᆢ
275,Angry Birds Rio,이야 역시 재밌어요!
276,Angry Birds Rio,앵그리버드 rio 이 게임은 너무너무 재미있어요. 만든  사람들 정말 고마워요.
277,Angry Birds Rio,세상에서 가장 완벽한 게임은 앵그리버드입니다
278,Angry Birds Rio,오 it a very good game!
279,Angry Birds Rio,Sgoe S go ei  desne
280,Angry Birds Rio, 앵그리버드만 한 게 없습니다
281,Angry Birds Rio,앵그리버드 안녕하세요
282,Angry Birds Rio,very nice i love this game!
283,Angry Birds Rio,앵글 앵글 ᄏᄏᄏᄏᄏᄏᄏ 재미있어요
284,Angry Birds Rio,나 이거 설치 중.... 배영희
285,Angry Birds Rio,리오 2 깃털은 어디서 얻을 수 있나요?
286,Angry Birds Rio,Goob 아주 잼 있어요
287,Angry Birds Rio,오어야 어어어
288,Angry Birds Rio,짱!!!!! 추석은 앵그리버드와 함께 ㅋ
289,Angry Birds Rio,Good!! 졸잼
290,Angry Birds Rio,음. 이건 심심할 때 하는 게 재미있을 거 같네요 :)
291,Angry Birds Rio,우왕 고퀄ㄷㄷ
292,Angry Birds Rio,굿 스트레스 풀기 딱 좋음
293,Angry Birds Rio,ㅗ~~ ㄱㅁㄴ덤ㅂ오오
294,Angry Birds Rio, 꿀 잼!!
295,Angry Birds Rio, 이딴 게임은 너무 재밌어서 꼭 해야 돼요
296,Angry Birds Rio,꿀젬 나 다 깼는데 완전 재미있어요
297,Angry Birds Rio,정말 귀여워요 새들이 재롱떠는 거 진짜 귀여워요
298,Angry Birds Rio,ㄱ쿡 재잇짱
299,Angry Birds Rio, 고전. 그래도 잼 따
300,Angry Birds Rio,재 ᄏ 재미있네요
301,Angry Birds Rio,말 이 필요 없음 그냥 꿀 잼임
302,Angry Birds Rio,굿이오. 앵그리버드 시간 때우기용으로 딱이네요.^^
303,Angry Birds Rio, 짱!!!!
304,Angry Birds Rio,최고 머라 말할 설명도 없이 최고!!!
305,Angry Birds Rio,정말 괜찮은 앵그리버드 리오 왜냐하면
306,Angry Birds Rio,짱 이거 참 재미네요 해보세요
307,Angry Birds Rio,재밌어요 하다 보니 재미있는 것 같아요
308,Angry Birds Rio,심심할 때 하면 재밌어요~ 할 거 없을 때 하면 재밌어요
309,Angry Birds Rio,재미있음 오랜만에 다시 하니 여전히 재미있네요~~
310,Angry Birds Rio,앵그리버드 가 젤 좋아
311,Angry Birds Rio,이거 재밌음 왕 꿀 잼
312,Angry Birds Rio,재밌다 이거 대졸 잼인 듯
313,Angry Birds Rio,그냥 최고다 할 말 없다
314,Angry Birds Rio,에그 리보 드리오 재미있음
315,Angry Birds Rio, 지미다
316,Angry Birds Rio,국군 제미
317,Angry Birds Rio, 데끼립니다
318,Angry Birds Rio, 재미나요
319,Angry Birds Rio,박준수 와
320,Angry Birds Rio,츙 츙츙짱
321,Angry Birds Rio,재밌을 듯
322,Angry Birds Rio,쫗아쫗아 잼
323,Angry Birds Rio,굿 정말 할 말이 없다... 암튼 정말 재밌다
324,Angry Birds Rio,허는 별 재미다
325,Angry Birds Rio, 이것은 완벽한 게임입니다
326,Angry Birds Rio,최고 너무 멋지고 짱
327,Angry Birds Rio,재미있어요 리오 짱임
328,Angry Birds Rio,굿 잡 완전재미있슴
329,Angry Birds Rio,와 조작도 쉬움
330,Angry Birds Rio,재미나다 귀여운 것들
331,Angry Birds Rio,정말 재밌어 Wow!!!~재밌어
