,name,review
0,Infinite Flight - 비행 시뮬레이터," Can you add airport buildings, cities and more to Infinite Flight? I would appreciate it if you could add it"
1,Infinite Flight - 비행 시뮬레이터," Hello, can I ask for Air Pohang livery for CRJ200? It is the only plane they have in their fleet."
2,Infinite Flight - 비행 시뮬레이터, I want to add to a A350^^
3,Infinite Flight - 비행 시뮬레이터, 게임은 진짜 좋아요. 근데 제가 다운로드할 때 할인을 해서 공짜로 받고 들어갔는데 중간에 결제하는 게 또 있더군요. 그걸 무시하고 a380으로 KORD에서 EHAM으로 가는데 갑자기 화면 위쪽에 빨간 글씨가 뜨면서 갑자기 속력이 줄어들더군요. 어떻게 된 거죠?
4,Infinite Flight - 비행 시뮬레이터, 제가 세계여행 업데이트 전부터 했는데 정말 세계여행 업데이트까지 온 게 대단하신 것 같습니다. 앞으로 더 많은 기종과 도장들 그리고 전투기들 공항 여러 가지 것들을 많이 개발해주셨으면 좋겠습니다. 앞으로도 응원하겠습니다!! 감사합니다~^^
5,Infinite Flight - 비행 시뮬레이터, 인천공항 2여객 터미널 좀 추가해주세요 Please add lncheon airport (^-^)~~~
6,Infinite Flight - 비행 시뮬레이터," I really like this game to various airlines, Korean Air, Asiana Airlines, really and airplane type are. This game is really the best. But one thing I need a favor. Incheon International Airport to airports are added in Asia, please, please add - please."
7,Infinite Flight - 비행 시뮬레이터, Lol 게임을 목적으로 하지 마세요
8,Infinite Flight - 비행 시뮬레이터,
9,Infinite Flight - 비행 시뮬레이터, My favorite game! But why I need to play nother airplan for pay? I brought this game but why!!!!
10,Infinite Flight - 비행 시뮬레이터, this is very good game but please make jeju(제주) airport and gimpo 김포 airport
11,Infinite Flight - 비행 시뮬레이터, Could you add A350 aircraft including Asiana Airline?
12,Infinite Flight - 비행 시뮬레이터, I want A350-900 or 1000 can you make A350??
13,Infinite Flight - 비행 시뮬레이터, Hello~ I am korean. Thank you for make this game. This game is perfect!!
14,Infinite Flight - 비행 시뮬레이터, Please add B737 MAX
15,Infinite Flight - 비행 시뮬레이터," Please add b747 Dream Lifter, a330-743l"
16,Infinite Flight - 비행 시뮬레이터, 대한민국 인천공항 해주세요
17,Infinite Flight - 비행 시뮬레이터, please a380 renewal!
18,Infinite Flight - 비행 시뮬레이터, This is game is very very good game.
19,Infinite Flight - 비행 시뮬레이터, pleas add incheon airport
20,Infinite Flight - 비행 시뮬레이터, please add a350 - 900
21,Infinite Flight - 비행 시뮬레이터," I hope add new plane ""Antonov An-225"" this game."
22,Infinite Flight - 비행 시뮬레이터, Please add ASG-29
23,Infinite Flight - 비행 시뮬레이터, hello! l'm from korea! today l play this game! this game is very fun!
24,Infinite Flight - 비행 시뮬레이터, Good!!!
25,Infinite Flight - 비행 시뮬레이터, Pleas make a A350...
26,Infinite Flight - 비행 시뮬레이터, 공항 건물도 추가로 만들어 주세요.
27,Infinite Flight - 비행 시뮬레이터, 멀티를 돈 말고 공짜로 해주세요
28,Infinite Flight - 비행 시뮬레이터, 무료 이벤트라니 감사합니다
29,Infinite Flight - 비행 시뮬레이터, 무료일 때 샀는데 고퀄이에요
30,Infinite Flight - 비행 시뮬레이터, 꿀 잼 유료인 이유
31,Infinite Flight - 비행 시뮬레이터, 결제가 안됩니다
32,Infinite Flight - 비행 시뮬레이터, 그냥 좋아요
33,Infinite Flight - 비행 시뮬레이터," I am playing very fun. However, I would like to add a speed setting function that can speed up time to enjoy long distance flight better."
34,Infinite Flight - 비행 시뮬레이터," Hello, im 12 yearsold.plz make more free airplane and open korea airplane. At last plz play to free multi"
35,Infinite Flight - 비행 시뮬레이터, Pleses change a333 cokpit this is so agly
36,Infinite Flight - 비행 시뮬레이터, 이건 최고의 게임이에요!! 감사합니다 ♡♡
37,Infinite Flight - 비행 시뮬레이터, 멀티는 몰라도 비행기 좀 사게 만들어줘요 저번에 비행기 따로 살 수 있었는데 왜 멀티랑 통합된 거죠.. 아니면 솔로로 세계 비행 좀 할 수 있게 해주세요 그것도 안되면 공항 3D랑 주변 환경을 좀 구축하던가 활주로만 달랑 있으면 뭔 재미로 함
38,Infinite Flight - 비행 시뮬레이터," Can U add koreanair boeing787-9 livery....,? It's buetiful!! You guys will also love it!!!!😀😀"
39,Infinite Flight - 비행 시뮬레이터, 한글 수정 좀 부탁해요
40,Infinite Flight - 비행 시뮬레이터, PERFECT UPDATE AGAAAAAAIN!!!
41,Infinite Flight - 비행 시뮬레이터, 엄청 좋아요! 고퀄리티에다가 항공기도 많아서 엄청 좋아요!!!
42,Infinite Flight - 비행 시뮬레이터, 최고 쵝ᆢ 최고
43,Infinite Flight - 비행 시뮬레이터," 휴대폰 변경 후 다시 깔고 시작했더니, 이건 접속과 함께 결제로 산 내 비행기들은 온데간데없고 완존 초기화에 카드로 현질해서 게임까지 샀는데도 초기형 개임... 돈으로 산 항공기 돌려주던가 환불해주던가 하시죠! 정말 잘 만들고 욕먹는 게임되지 마시고요! 비행과 항공기를 좋아하는 유저로써 부탁드립니다! 정말 소비자를 우롱하는 거라면 소비자고발센터에 신고합니다!"
44,Infinite Flight - 비행 시뮬레이터, 몇 년간 플레이를 해왔습니다. 너무 훌륭합니다. 개발자님들 너무 수고하십니다 어떤 애플리케이션도 비교가 안되는군요. 멀티를 위해 한 달에 10000씩 내고 있는 거 아깝지 않아요. 계속 앱을 발전시켜주세요♡♡
45,Infinite Flight - 비행 시뮬레이터, 정말 최고 게임입니다. 하지만 5900원이라는 가격에 불구하고 사용 가능한 비행기가 너무 적습니다. 가능 비행기를 늘려주시고 멀티플레이는 필요 없습니다. 제발 국제비행 가능하게 해주세요.
46,Infinite Flight - 비행 시뮬레이터, 비행기 무료로 해주세요 다요 5900원 내고 산 게임 안에서 또 현질해서 하는 건 좀 아니라고 생각하고 최고급 게임인 것 같아요 더 재미있는 게임 올려주세요
47,Infinite Flight - 비행 시뮬레이터, 제가 좋아하는 대한항공과 아시아나항공을 운전할 수 있어서 좋아요 하지만 단점이 돈 내고해야 해서 그래도 재밌어요
48,Infinite Flight - 비행 시뮬레이터," It's graphic is so good but if there are moving instrument panel, we can enjoy this game more excited"
49,Infinite Flight - 비행 시뮬레이터, 그냥 갓겜 근데 korea air787 좀추가해줬습 합니다
50,Infinite Flight - 비행 시뮬레이터, i want refund!! i really like this game but i have not enough money to pay this timeㅠㅠ
51,Infinite Flight - 비행 시뮬레이터, 제발 한국에 구매하지 않아도 뜨는 공항 좀 추가해주세요...
52,Infinite Flight - 비행 시뮬레이터, I think it will be pretty good to have airport.
53,Infinite Flight - 비행 시뮬레이터, This game is very fun. But When come out A350 Series? 영 알 못이라고..
54,Infinite Flight - 비행 시뮬레이터, Please add more korean air on IF. please add korean air MD11 VERSION!!^^
55,Infinite Flight - 비행 시뮬레이터, 에어버스 a350 추가해주세요
56,Infinite Flight - 비행 시뮬레이터," Very very very good!, please a350"
57,Infinite Flight - 비행 시뮬레이터, Please add Incheon Int'l Airport
58,Infinite Flight - 비행 시뮬레이터, 환불 요청드립니다
59,Infinite Flight - 비행 시뮬레이터, umm.... good game! but... no Korean air B787...?
60,Infinite Flight - 비행 시뮬레이터, 정말 좋아요!!
61,Infinite Flight - 비행 시뮬레이터, Very very puny
62,Infinite Flight - 비행 시뮬레이터, 다 최고입니다
63,Infinite Flight - 비행 시뮬레이터,
64,Infinite Flight - 비행 시뮬레이터,
65,Infinite Flight - 비행 시뮬레이터,
66,Infinite Flight - 비행 시뮬레이터, 좋은 게임이지만 비행기를 꼭 pro를 사야지만 더 살 수 있는 것을 그냥 돈 내고 살 수 있게 해주시면 안돼요?.
67,Infinite Flight - 비행 시뮬레이터, 다 좋은데 비행기는 조금만 늘려주셔도 되는데 전 멀티가 하고 싶어서 멀티 할 수 있게 하셨으면 감사하겠습니다
68,Infinite Flight - 비행 시뮬레이터, 일단 샀으니 플레이해보고 후기 다시 남길게요!
69,Infinite Flight - 비행 시뮬레이터, I bought this application on 2015. Suddenly it says to uninstall and purchase from the Playstore. I really don't wanna delete this app due to logbook. Please help me about this proble. I really wanna fly again. Thanks for your effort of developing this fantastic app.
70,Infinite Flight - 비행 시뮬레이터, 결제하지도 않았는데 결제됐어요 취소해주세요
71,Infinite Flight - 비행 시뮬레이터, 다 좋은데 야간비행을 할 때 랜딩 라이트 효과가 나타나게 해주세요.
72,Infinite Flight - 비행 시뮬레이터, 대한민국 저가항공사 추가 부탁드립니다
73,Infinite Flight - 비행 시뮬레이터, 다 좋은데 렉이 많이 걸리네요
74,Infinite Flight - 비행 시뮬레이터, 추가 비행기 유료입니다. 참고하세요
75,Infinite Flight - 비행 시뮬레이터, 너무 좋음
76,Infinite Flight - 비행 시뮬레이터, 너무 훌륭한 게임입니다 다만 많은 경고음을 추가해 주세요(예를 들면 whoop pull up) 또 많은 공항과 착륙할 때 타이어 연기가 나오게 해주세요 건물도 추가해주시면 별 10000000 만개 일 것 같습니다^^
77,Infinite Flight - 비행 시뮬레이터, 제가 보잉 777 200er을 구매하려고 하는데 구매 창의 뜨지 않고 계속 purchase fail이라고 떠요 어떻게 하면 구매할 수 있죠?
78,Infinite Flight - 비행 시뮬레이터, How can I cancel my regular payment for online play? I send an email last week but I didn't get any reply
79,Infinite Flight - 비행 시뮬레이터," After I paid for it, I ran the game right away, and it didn't work, and it just keeps playing the black screen. What should I do?"
80,Infinite Flight - 비행 시뮬레이터, I want to buy a plane but they say I need a subscription. Why does this happen?
81,Infinite Flight - 비행 시뮬레이터, Please add light on runway and bright landinglight
82,Infinite Flight - 비행 시뮬레이터, 업데이트 많이 해준 새요 한국 저가항공사 추가해주세요 재미있어요
83,Infinite Flight - 비행 시뮬레이터, 너무 재밌어요 매일매일 잘하고 있습니다 제작자님 감사합니다
84,Infinite Flight - 비행 시뮬레이터, a350 추가해주세요
85,Infinite Flight - 비행 시뮬레이터, Add a350 please...
86,Infinite Flight - 비행 시뮬레이터," Thank you for your hard work. But I got the problem after I updated. All textures are black only except airplane. And... if possible. I hope, you can optimize app... as I have updated since 2015.. it gets slow and slow... (Galaxy Note4)"
87,Infinite Flight - 비행 시뮬레이터," AIRBUS 350-900아시아나 항공이랑, 제주항공이나 에어부산같이 저가항공사도 넣어주셨으면 좋겠네요ㅎㅎ"
88,Infinite Flight - 비행 시뮬레이터, 저가 LG 폰을 쓰는데 업데이트 후 랙이나 버퍼링이 너무 심해요 꼭 수정해주세요
89,Infinite Flight - 비행 시뮬레이터," This game is very good simulation But, we need Landing light effect for night flight Thanks:)"
90,Infinite Flight - 비행 시뮬레이터," Great!! But l want more korea airlines ex) jinair, jejuair...."
91,Infinite Flight - 비행 시뮬레이터, 실수로 구매했어요 환 불가능한가요
92,Infinite Flight - 비행 시뮬레이터, 그래픽이 정말 최고입니다. 업데이트 많이 해주세요.
93,Infinite Flight - 비행 시뮬레이터, error rogging in???????? whats wrong?? I paid you.. 100 dollers. right?? why not use to your game??? answer me now~!!!!!
94,Infinite Flight - 비행 시뮬레이터, 바닥은 까만색으로 돼요 있나요?
95,Infinite Flight - 비행 시뮬레이터, Wow!! It's soooo good!!
96,Infinite Flight - 비행 시뮬레이터, Why the floor it's black??
97,Infinite Flight - 비행 시뮬레이터, 새로운 기종 추가해주세요 a350 등등
98,Infinite Flight - 비행 시뮬레이터, 환불해주세요
99,Infinite Flight - 비행 시뮬레이터, Goooooooooooooood~~~~~~~~~~~
100,Infinite Flight - 비행 시뮬레이터, 최고!!
101,Infinite Flight - 비행 시뮬레이터," One of the best flight sims on mobile. Good multiplayer, good graphics. One con is that the aircrafts take up too much space :( Also, really worth buying global. (한국인 분들! 글로벌이 너무 비싸다고 하시는데 이렇게 대규모 서버 확보와 유지하는데 돈 엄청든다 고니다. 너무 많이 뭐라 하지는 말아 주세요.)"
102,Infinite Flight - 비행 시뮬레이터, Control is great! Graphic is also great! I like the global update!  P.S 한국 분들... 제발 남기실 때에는 영어로 부탁드립니다 Please write in English plaese!
103,Infinite Flight - 비행 시뮬레이터," 안녕하세요 infinite flight 한국 님 저는 이 게임을 즐겨 하고 있는 초등학생입니다 제가 원하는 것이 있는데... 그것은 꽤 많은데... Jeju air, jin air, air busan 같은 대한민국 저가항공사는 없어서 슬픕니다.. 다운로드할 수도 없고 왜냐면 리페인트 금지하셨으니까요 그러니... 대한민국 항공기 좀 추가해주세요 바쁘시겠지만 그리고 비행기 착츅할때 바퀴에서 연기가 나왔으면 좋겠네요 아니면 실감이 안 나서요 ㅠ 부탁드립니다"
104,Infinite Flight - 비행 시뮬레이터," Everythings are great! But I would be more happy if you guys make some real situations in the game environment. Like bird strikes, some buildings, more airlines (in south korea, if possible ><;;) Thank you for making this amazing game I'm always enjoying playing your game. THANK YOU."
105,Infinite Flight - 비행 시뮬레이터,이것 좀  봐주세요 리뷰할 때 제발 부탁인데 한국 비행기 추가해달라고 하지 마세요....  무슨 개발자가 수백 개의 비행기 회사 만들 수 있겄습시까
106,Infinite Flight - 비행 시뮬레이터, 택시 라이트하고 기내 뷰 좀 넣어주세요 그리고 핸드폰으로만 틸트 하는 거 말고 스크린에 있는 조이스틱도 추가해주세요 밤에 비행하려니가 스트로브하고 비콘 라이트도 너무 약해서 다른 뷰에서 비행하기가 힘들더라고요 그 부분만 조금만 더 보완해주세요
107,Infinite Flight - 비행 시뮬레이터, 착륙할 때 바퀴에 연기해주고요  그리고 하늘에 있을 때 랜딩기어가                                                     _                         °°°이렇게 앞으로 가지 말아 주고요                         \                         \     이렇게 세워 저 있었으면 좋겠습니다.
108,Infinite Flight - 비행 시뮬레이터," Is this Really mobile game?   Global update is very nice and amazing I can't blieve this update. And infinite flight is the more amazing in mobile game. But, I think this game is so expencive.. you shuold down a prices."
109,Infinite Flight - 비행 시뮬레이터, Please make me Korean air boing 787-9. I beg you     thank you 대한항공 보잉 787-9좀 만들어주세요. 제발요 부탁드립 나다♡♡^^
110,Infinite Flight - 비행 시뮬레이터,
111,Infinite Flight - 비행 시뮬레이터, 그래픽도 좋고 다 좋은데 공항에 건물이나 관제탑. 다른 비행기가 있었으면 좋겠네요... 그래야 더 실감 나고요
112,Infinite Flight - 비행 시뮬레이터, 고태 웅남 만일 이 게임이 업데이트되면 비행기가 다 없어지는 게 아니고 자신이 구입한 비행기는 다시 다운로드만 다 해주시면 됩니다. 그니까 자신이 구입한 비행기는 절대 없어지지 않아요
113,Infinite Flight - 비행 시뮬레이터, 자동 결제되네요? 23일 자 취소해주세요
114,Infinite Flight - 비행 시뮬레이터," 저기 B777-300er, B787-9에 대한항공 Korean air넣주세요 Please make me korean air B777-300, B787-9 please please"
115,Infinite Flight - 비행 시뮬레이터, 돈 내고 깔아는 데 왜 또 돈을 내야 하는지
116,Infinite Flight - 비행 시뮬레이터, 저기요 저 이거 오류가 나서 안 되는데 환불 좀 해주세요
117,Infinite Flight - 비행 시뮬레이터, 제 돈 주고 산 비행기들이 전부다 사라졌네요 복구 부탁드릴게요
118,Infinite Flight - 비행 시뮬레이터, 진짜 모바일  시뮬레이터 중  최고다    꼭  다운로드하시길
119,Infinite Flight - 비행 시뮬레이터, I really enjoy your game!! But many Korean users want to add more airliners in South Korea. And also please solve some bugs. I'm south korean so there may be grammatical error there ;; But I hope you can under stand. Thank you
120,Infinite Flight - 비행 시뮬레이터," Why is it that multl-months sell for 11,000won? I paid 5,500won for the game and I also asked you to spend money. The next update is to make it 8,000won per month. Please."
121,Infinite Flight - 비행 시뮬레이터, It's good simulator. but RKPC and RKSS gate is RKPC:0 RKSS:1 please add a RKPC RKSS gate
122,Infinite Flight - 비행 시뮬레이터, 좀 더 많은 항공사와 항공기가  나왔으면 좋겠네요 ^^
123,Infinite Flight - 비행 시뮬레이터," Hello I am a Korean user enjoying this. I do not know English .. I do not know what to buy multiplayer, there are three ... And I would like you to support Korean."
124,Infinite Flight - 비행 시뮬레이터," Please make... I'd like to make a trainer, T-50. Make sure you make it!!"
125,Infinite Flight - 비행 시뮬레이터," I want to play global version. Then I have to buy online version. But I'm a student and I don't have enough money. I just want to play solo. Please add, play global version without online."
126,Infinite Flight - 비행 시뮬레이터, 유석호 님 이거 Korea Air 있어요 많이. 제작자님 너무 재미있어요  개꿀
127,Infinite Flight - 비행 시뮬레이터, 구름이 있으면 좋겠음 ㅎㅎㅎ
128,Infinite Flight - 비행 시뮬레이터, Runway is strange.. It is like ice!!!!!!    I can't take off as usual
129,Infinite Flight - 비행 시뮬레이터, 다행히. 돌라왔어요
130,Infinite Flight - 비행 시뮬레이터, 저 관제 좀 추가해주세요
131,Infinite Flight - 비행 시뮬레이터, This is the auto pilot operating key that's been changed.  How can I move to the right?
132,Infinite Flight - 비행 시뮬레이터," That's very great game :) But, I want Boeing 787-8,9 Korean Airlines Paint."
133,Infinite Flight - 비행 시뮬레이터, 어떻게 해야 grade 1 탈출하나요? 비행시간 3시간
134,Infinite Flight - 비행 시뮬레이터, 업데이트되면서 퀄리티가 상당히 높아졌습니다 모바일 시뮬레이션으로서 추천드립니다
135,Infinite Flight - 비행 시뮬레이터, 인기 유료 게임 3위 축하드립니다! 시뮬에서요
136,Infinite Flight - 비행 시뮬레이터, Good for you if you and to add some view the free airline ju added a lot of St. ᆞ.^^^
137,Infinite Flight - 비행 시뮬레이터, Please make multiplay free
138,Infinite Flight - 비행 시뮬레이터, Thats game bery good and not bad
139,Infinite Flight - 비행 시뮬레이터, 다 좋은데  비행기가 잘 가다가 갑자기 추락한다
140,Infinite Flight - 비행 시뮬레이터, Can I add a joystick?
141,Infinite Flight - 비행 시뮬레이터, I think it's beautiful.
142,Infinite Flight - 비행 시뮬레이터, 정말 금속이십니다
143,Infinite Flight - 비행 시뮬레이터, Thanks!
144,Infinite Flight - 비행 시뮬레이터, 이거 완전 되박이 양!!!!!!!!!!!!!
145,Infinite Flight - 비행 시뮬레이터, 비행기 너무 비싸요......... 건데 꿀 잼..
146,Infinite Flight - 비행 시뮬레이터, Best Game!
147,Infinite Flight - 비행 시뮬레이터, 그래픽이 좋아요
148,Infinite Flight - 비행 시뮬레이터, 좋네요
149,Infinite Flight - 비행 시뮬레이터, 좋아요
150,Infinite Flight - 비행 시뮬레이터, This simulator is very good. But infenete flight pro is very expensive
151,Infinite Flight - 비행 시뮬레이터, Please A350-900
152,Infinite Flight - 비행 시뮬레이터, 재밌고 할만하고 좋으나 로그인이 안 되고 너무 랙이 걸리네요 너무 억지인 것 같지만 환불 가능한가요?
153,Infinite Flight - 비행 시뮬레이터," 제가 폰 기종이 Q6이거든요 근데 들어가고 나면 렉이 너무 걸려요 이것만 해결해주시면 별 5개 들릴게요 제발...... I have gijong. But it takes too long to get in. If you work this out, I can hear five stars, please ......"
154,Infinite Flight - 비행 시뮬레이터, 이게 5천 원짜리 시뮬레이션이라니 대단합니다 앞으로도 계속 발전했으면 좋겠군요.
155,Infinite Flight - 비행 시뮬레이터, 렉이 너무... 차라리 업데이트 안돼도 괜찮은데.ㅠ
