,name,review
156,Infinite Flight - 비행 시뮬레이터, ☆ Inside the fun game. lt s the fltst time l ste it up today. ☆
157,Infinite Flight - 비행 시뮬레이터, I have a hotas4 joystik but the throttle does not work. Please let me know how to work throttle of the hotas4 joystick. Thank you!
158,Infinite Flight - 비행 시뮬레이터," I think this is the best flight simulator. This quality is as same as real airplane. So, this game is very good!!!!!!!! It is perfect game to me."
159,Infinite Flight - 비행 시뮬레이터, 한 달간만 구독 신청했는데 왜 다음 달 자동 결제가 되나요 환불 부탁드려요
160,Infinite Flight - 비행 시뮬레이터, 오랜만에 접속해보니 왜 안되죠?  돈 주고 구매했는데 돈은 또 결제해야 되는 건가요?
161,Infinite Flight - 비행 시뮬레이터, 로고 라이트 추가해주세요 Please add a 'LOGO LIGHT'.
162,Infinite Flight - 비행 시뮬레이터, This game is excellent best simulater on the mobile however I hope there will be A350 soon
163,Infinite Flight - 비행 시뮬레이터, 글로벌 온라인 버전 할인 행사 같은 이벤트만 하면 괜찮을 거 같네요
164,Infinite Flight - 비행 시뮬레이터, 비행기 무료로 해주세요
165,Infinite Flight - 비행 시뮬레이터, 비행기 좀 싸게 해주세요
166,Infinite Flight - 비행 시뮬레이터, 오늘 삼 ㄱㅇㄷ.
167,Infinite Flight - 비행 시뮬레이터, Wow this is really  good
168,Infinite Flight - 비행 시뮬레이터, 들어가지지가 않아요.
169,Infinite Flight - 비행 시뮬레이터, 4년을 기다려서 드디어 글로벌 플라이트를 구매하였는데 역시 인피니트 플라이트 실망을 안 시키네요 너무 좋아요
170,Infinite Flight - 비행 시뮬레이터, 와 이 게임 핵꿀잼이내요(정품유저)님들 재밌죠? 나도 정품 유저인데 그리고 정용 희 님 풀어 같은 경고 있어요
171,Infinite Flight - 비행 시뮬레이터, 제가 처음으로 한 번 사봤는데 렉이 걸리고 환불하려는데 환불이 안됩니다. 1번 결제했는데 결제가 안되는데 환불해 주세요
172,Infinite Flight - 비행 시뮬레이터, 업데이트 이후 정상적인 플레이가 불가능하게 버그가 발생하고 pro 버전 값이 비싸다
173,Infinite Flight - 비행 시뮬레이터, 계속  렉이 걸려요   오류 좀  고쳐주시거나   환불해주세요
174,Infinite Flight - 비행 시뮬레이터, 꿀 잼!
175,Infinite Flight - 비행 시뮬레이터, 갓겜
176,Infinite Flight - 비행 시뮬레이터, 완전 굳굳
177,Infinite Flight - 비행 시뮬레이터, 그래픽이 좋네요
178,Infinite Flight - 비행 시뮬레이터, Thanks for  update  ICN airport!  Can you  make  Korean air Boeing787-9? Korean air have 787-9  But No korean air 787-9 this game
179,Infinite Flight - 비행 시뮬레이터, a small sound issue  when doing left and right wing camera but still the update is fantastic
180,Infinite Flight - 비행 시뮬레이터, OH THIS IS nice game please plus the helicopters
181,Infinite Flight - 비행 시뮬레이터, 최고의 항공 시뮬 게임이지만 안드로이드 업데이트는 언제인가요?
182,Infinite Flight - 비행 시뮬레이터," 787-10을 몇 달 전에 구매를 했는데 휴대폰 교체 후 다시 구매하라고 뜨네요... 복구 가능한가요? I have purchased new plane 787-10 few months ago. After a newbdownload of the game, i have found that 787 was locked from me and asking me to pay to play. Please check and correct it. Thanks."
183,Infinite Flight - 비행 시뮬레이터, 업데이트는 언제인 건가요? 유튜브상에서는 글로벌 비행 업데이트와 MD 11이 새로 추가된다고 하는데 너무 기대됩니다... 언제 업데이트가 이루어질까요??? When is the update??? In youtube people are saying that infinite flight has a new update coming up with MD 11 and global flight.... i'm pleased to receive an answer...
184,Infinite Flight - 비행 시뮬레이터," 지금 뭐 추가해달라 하지 마세요 안 그래도 글로벌 플라이트 버그 해결도 하고 있고 MD-11, DC-10 모델링도 하고 있는데 그런 것까지 일일이 다 들어주면 제작자들이 무슨 Area 51 외계인입니까? 제작자들이 알아서 할 거니까 이 정도 퀄 게임 못 만들면 가만히 플레이나 하세요"
185,Infinite Flight - 비행 시뮬레이터," The quality is good for the price. But if you try to multi-player and airplane, it costs too much money.=가격 대비. 퀄리티가 좋습니다. 하지만 비행기와 멀티플레이를 하려면 돈을 너무 많이 내야 하네요."
186,Infinite Flight - 비행 시뮬레이터, 핸드폰을 바꾸고 나서는 자꾸 무료 다운로드 뜨면서 누르면 스토어에 오는데 할 수가 없네요. 돈 주고 산 의미가 이제 없습니다.
187,Infinite Flight - 비행 시뮬레이터, 기내방송은 Infinite Passengers 다운로드하시면 되고 한국공항은 한국 유저분들이 열심히 제작 중이시고 우리나라 LCC들은 미국인인 제작자가 알 수 없고 멀티는 유료이고
188,Infinite Flight - 비행 시뮬레이터, 휴대폰을 바꿔서 접속하니 유료 비행기들이 없어졌네요 구매 내역도 다 있는데 확인 부탁합니다
189,Infinite Flight - 비행 시뮬레이터, 안드로이드용은 언제 업데이트되나요?ㅠ 아이폰은 됐다고 하던데 안드로이드는 언제쯤 될까요? 빨리하고 싶네요.... ㅠ
190,Infinite Flight - 비행 시뮬레이터, 제가 제작자분께 복구해달라고 이메일을 보내니까 몇 시간도 안 돼서 복구시켜주셨네요. To:Tyler  Thank you for backup Tyler  To:A380TV
191,Infinite Flight - 비행 시뮬레이터," 비행기 착륙할 때 연기나면 별 5개임. 그리고 질문 멀티는 어떻게 하나요? 또 제주항공, 이스타항공, 티웨이항공, 에어부산, 진에어가 있으면 별 5개 드리겠습니다."
192,Infinite Flight - 비행 시뮬레이터," 그래픽, 기종 등 모든 게 완벽합니다. 조금 아쉬운 점은 공항 터미널이 없다는 것이죠."
193,Infinite Flight - 비행 시뮬레이터, 버그 신고. 저공에서 F-22로 마하 2 정도의 속도로 비행했는데 진동이 점점 심해지다가 기체가 요동을 치며 추락했습니다. 이건 버그라고밖에 생각이 안되네요
194,Infinite Flight - 비행 시뮬레이터, 공항에 게이트나 입체로 만들고 관제 시 막  허가번호 같은 거 만들어 주시면 최고임!
195,Infinite Flight - 비행 시뮬레이터, 너무 재미있는 비행기 게임인 거 같습니다! 정말 실현 같아서 더 좋아요~ 제작자님 고맙습니다.
196,Infinite Flight - 비행 시뮬레이터, 시뮬레이터 중 가장 완벽한 게임인 것 같아요 A350은 언제 나올까요 정말 기대됩니다
197,Infinite Flight - 비행 시뮬레이터, 1년 후에 업데이트됩니다 저도 기대되네요😇😇
198,Infinite Flight - 비행 시뮬레이터," Request updates   First, add the function to turn the engine off and off.  Second, please add the airport building.  Third, let me move with the real aircraft cockpit.  Fourth, add landing performance.  Fifth, please add Korean maps and airports.  Thank you always."
199,Infinite Flight - 비행 시뮬레이터, 살짝 게임이 자꾸 끊기는 현상이 있네요 이것 좀 고쳐주세요
200,Infinite Flight - 비행 시뮬레이터," 정말 좋은데 항공기 랜딩기어가 활주로에 착륙할 때 연기나는 거랑 기내방송(한국어),공항터미널,지상작업(요원,토잉카등)부탁드립니다."
201,Infinite Flight - 비행 시뮬레이터, Add Korean air at boeing787-9 Korean air have it already and pls update cockpit graphic it look like mass
202,Infinite Flight - 비행 시뮬레이터, 제가 정식으로 사고 멀티 하려고 구글 계정으로 로그인했는데 갑자기 계정을 찾을 수 없습니다 뜹니다 저 오는 샀거든요 페북으로 해도 안되잖아 복구 안 해줄 거면 돈 물어내요!!!!!!!!!!
203,Infinite Flight - 비행 시뮬레이터," 컴퓨터는 p3d로, 핸드폰은 인플레 보내라 카더라"
204,Infinite Flight - 비행 시뮬레이터, 공항 추가해주시면 감사하겠습니다. 공항이 너무 허무해 보여서요.ㅜㅜ
205,Infinite Flight - 비행 시뮬레이터," What a nice game! Nice graphics!   But can you add Landing smoke , Tilt the wheel, and add Incheon International Airport? Then it will be great!"
206,Infinite Flight - 비행 시뮬레이터, 모든다 좋거든요 근데 환불해 주세요
207,Infinite Flight - 비행 시뮬레이터, 좋아요~항덕들에게 좋은 게임!
208,Infinite Flight - 비행 시뮬레이터, 운영자님 다 좋은데 대한항공 a330 300공짜로 해주시면 안 될까요 ㅠㅠ
209,Infinite Flight - 비행 시뮬레이터, 제가 Boeing-747 SCA 샀는데 그게 없어졌어요 복구해주세요 F 22는 있는데 Boeing 747-SCA만 없어졌어요
210,Infinite Flight - 비행 시뮬레이터, 좋고 재밌습니다 ㅎㅎ
211,Infinite Flight - 비행 시뮬레이터, 기가 막힌 게임!
212,Infinite Flight - 비행 시뮬레이터, 이거 외 다른 시뮬이라 하는 것들은 쓰레기인 듯 싶..
213,Infinite Flight - 비행 시뮬레이터, Please add 3D airport!!!!!!!
214,Infinite Flight - 비행 시뮬레이터, boeing 777free state!
215,Infinite Flight - 비행 시뮬레이터, 정말 재밌고 완벽한 시뮬 이예요! THE GREAT FLIGHT SIM!
216,Infinite Flight - 비행 시뮬레이터, Please add a350
217,Infinite Flight - 비행 시뮬레이터, 업데이트 기다립니다
218,Infinite Flight - 비행 시뮬레이터, hi i.m cheese um..... what anderoid update?
219,Infinite Flight - 비행 시뮬레이터, 건물이 없어요.
220,Infinite Flight - 비행 시뮬레이터, fun. but many air plane free =very fun game
221,Infinite Flight - 비행 시뮬레이터, 저는 한국 비행가 있어서 참 좋다
222,Infinite Flight - 비행 시뮬레이터, 모든 세계를 만들어주세요
223,Infinite Flight - 비행 시뮬레이터, 정말 최고의 비행기 게임입니다
224,Infinite Flight - 비행 시뮬레이터, So good
225,Infinite Flight - 비행 시뮬레이터, Good
226,Infinite Flight - 비행 시뮬레이터, 그래픽 굿! 아주 좋아요!
227,Infinite Flight - 비행 시뮬레이터, Real  Good!!!! loooooool
228,Infinite Flight - 비행 시뮬레이터, GOOD
229,Infinite Flight - 비행 시뮬레이터, 꿀 잼
230,Infinite Flight - 비행 시뮬레이터, 최고예요!!!!!
231,Infinite Flight - 비행 시뮬레이터, 감사합니다
232,Infinite Flight - 비행 시뮬레이터, 최고
233,Infinite Flight - 비행 시뮬레이터, 너무 좋아요 항덕들에게 있어 좋은 시뮬레이션입니다. 근데 헬기랑 공항 건축을 해줬면 합니다 만드는 데 힘들고 오래 걸려도 이시뮬유더들을위해만들어쥤으면합니다
234,Infinite Flight - 비행 시뮬레이터, 먼저 그래픽이 사기이고여 컨트롤도 간편히 감도 조작만 하면 재미있게 할 수 있을 것 같습니다. 별 5점도 모자라는 게임입니다.
235,Infinite Flight - 비행 시뮬레이터, 혁신적인 게임입니다.... 다만 재일 하고 싶은 멀티가 유로라서...... 그래서 멀티를 유로 긴한데 평생 쓸 수 있게 해주시기 바랍니다..... 그래도 이런 게임 만들어 주셔서 매우 감사합니다~~^^
236,Infinite Flight - 비행 시뮬레이터,"Please add more livery B777-300ER:Air France(Real livery),Korean Air, Virgin Atlantic?(I forgot their name.) B787-9:Korean Air(They will receive 787 next year) A330-300:Asiana Airlines. I wish you think about it."
237,Infinite Flight - 비행 시뮬레이터,
238,Infinite Flight - 비행 시뮬레이터,화면크기 안드로이드 마시멜로 버전인데 화면크기 오류가 있습니다. 크게 보여서 버튼 및 선택이 불가합니다.
239,Infinite Flight - 비행 시뮬레이터," 정말 좋은데 에어버스 a350 기종 좀 넣어주세요 제작자님, please make a airbus a350 airplane and make a airport. This game very good"
240,Infinite Flight - 비행 시뮬레이터,"한국인들아 영어 좀 써라 님들 제작자 미국인입니다/그리고 악플 게임 개선하고 싶은 면 님들이 게임을 만들어라 좀 왜 운영자 탈영이냐?  문제가 있으면 알아서 좀 해라 Gimpo, Incheon and Yeosu, Jeju, Anyang, Cheongju, please make me, Osan Air Base"
241,Infinite Flight - 비행 시뮬레이터, The game is really good.But it would be nice to have an on-line intelligent control tower online. The airport is terrible when there is no controller.
242,Infinite Flight - 비행 시뮬레이터, 건물 입체로 해달라는 게 말이 안 되는 이유가 건물 싹 다 입체로 돼버리면 너희들 폰에서 돌아가지도 않아...
243,Infinite Flight - 비행 시뮬레이터, 건물들 좀 추가해 주시면 좋겠습니다. I'd like you to add buildings.
244,Infinite Flight - 비행 시뮬레이터, 제가 작년 9월에 5만 원어치를 결제를 하고 이번에 또이게 잠긴 거 같아요 1년이라고 했는데 그레 서제가 비행기 버튼을 눌렀는데 5000원이 결제가 돼서요 빠른 환불 부탁드립니다 저 화났어요
245,Infinite Flight - 비행 시뮬레이터,"Good Please add Landing Smoke, DC10, 747 400KAL , B767 Asiana, JINAIR, TWAY, EASTER JET, AIR SEOUL, AIR BUSAN, JEJUAIR, Sky Team Korean Air, Star Alience Asiana Airlines. B777 Asiana Cargo Please. And Airport Building. And Free AP. Thank you for seeing this review."
246,Infinite Flight - 비행 시뮬레이터, 비행기가 활주로로 가면 느려져요. 수정해 주세요.
247,Infinite Flight - 비행 시뮬레이터," The game is very good, but there's a problem. I tried to start recording, but it says that my device is not supporting. Recording worked until yesterday, but today it doesn't work."
248,Infinite Flight - 비행 시뮬레이터,한글 한글 페치가 조금 됫ㅇㄷ면좋겠습니다
249,Infinite Flight - 비행 시뮬레이터, 월드맵 업데이트 기대하겠습니다.
250,Infinite Flight - 비행 시뮬레이터, 비행기를 무료로 좀 해주세요 제밋케여
251,Infinite Flight - 비행 시뮬레이터, Please improve your landing light. It's too dark.
252,Infinite Flight - 비행 시뮬레이터," This is good flight simulator. when the night landings, I couldn't find taxiway. So, please add taxi light on flight."
253,Infinite Flight - 비행 시뮬레이터, 반품 요청 잘못 구매함
254,Infinite Flight - 비행 시뮬레이터, 건물을 3d로 만들면 좋겠고 세계 각국 언어도 있으면 최고가 될 수 있을 것 같습니다.
255,Infinite Flight - 비행 시뮬레이터,"Please refund Just paid $5.06 to subscribe multi, and it just can't find my account."
256,Infinite Flight - 비행 시뮬레이터, plz update taxiway light system of the airports. i cannot taxi to rwy at night:(
257,Infinite Flight - 비행 시뮬레이터," 밥 차, 기름통, 손님, 기름 빼는 것, 게이트 버튼작동,문여는것공항도입체로해주시고인천국제공항추가해주세요"
258,Infinite Flight - 비행 시뮬레이터, It's cool  but can you make the airport 4d? And 3engine plane in next update
259,Infinite Flight - 비행 시뮬레이터, 다 좋은데 관제가 얼마 전부터 안 되네요... 해결하신 분 있나요??
260,Infinite Flight - 비행 시뮬레이터, Please up date the world flying! And A350! I love this aircraft motion game. I played very good  PLEASE!!! UPDATE!! WORLD FLYING!! LURA! STAFF! UPDATE!!!
261,Infinite Flight - 비행 시뮬레이터, A350 추가 부탁드립니다
262,Infinite Flight - 비행 시뮬레이터, 제가 원하던 완벽한 비행 시뮬레이터입니다. 이 게임 제작자분들 감사해요
263,Infinite Flight - 비행 시뮬레이터, Please add 'Eastar Jet' paint (B737-800)(Korean LCC)
264,Infinite Flight - 비행 시뮬레이터," Thank you, sir please add a350 to this store and make the airport building 4D. Thank you"
265,Infinite Flight - 비행 시뮬레이터, I want to buy a multi but it doesn't open it
266,Infinite Flight - 비행 시뮬레이터, 정말 재밌습니다.
267,Infinite Flight - 비행 시뮬레이터, 공항이 3D였으면 좋겠어요
268,Infinite Flight - 비행 시뮬레이터," 정말 좋아요. 3D 건물이나 날씨(비, 눈)도 만들어주세요."
269,Infinite Flight - 비행 시뮬레이터, 그래픽 좀요
270,Infinite Flight - 비행 시뮬레이터, 어떻게 출발하죠
271,Infinite Flight - 비행 시뮬레이터, 진에어 랑 에어부산 추가해주세요...
272,Infinite Flight - 비행 시뮬레이터, LG G2에서 강제로 종류 됨
273,Infinite Flight - 비행 시뮬레이터," We need to new location, korea, and japan"
274,Infinite Flight - 비행 시뮬레이터, 이때까지 해본 비행기 시뮬레이터 앱 중 최고입니다.
275,Infinite Flight - 비행 시뮬레이터,짱 꿀젬
276,Infinite Flight - 비행 시뮬레이터,재밌네요 재밌네요
277,Infinite Flight - 비행 시뮬레이터, 최곸
278,Infinite Flight - 비행 시뮬레이터, 개쩜
279,Infinite Flight - 비행 시뮬레이터, god
280,Infinite Flight - 비행 시뮬레이터, 재밌음
281,Infinite Flight - 비행 시뮬레이터, 재미있는 게임
282,Infinite Flight - 비행 시뮬레이터, 너무 좋아요
283,Infinite Flight - 비행 시뮬레이터, 너무너무너무너무너무 좋아요.
284,Infinite Flight - 비행 시뮬레이터,"읽어주세요. 이 게임은 전문성을 요구하는 시뮬레이터입니다. 그러니 아무것도 모르고 사놓고 어렵다, 영어다 하지 마세요. 그리고 제발 개발자 트위터 좀 보세요. 개발자가 분명히 건물, 스모그, 날씨 만들지 않을 것이라고 밝혔습니다. 혹시 세계여행 맵이 개발 중인 것은 아시나요? 제발 게임을 하고 싶은 맘이 있다면 트위터 좀 보세요. 동해가 일본해라 표기되어 나옵니다. 뭐 어쨌든. 그리고 비행기. 멀티 무료 요구하지 마세요. 또 비행기 수익으로 멀티 운영하면 개발자는 뭐 먹고 삽니까? 부디 이 게임을 열심히 노력해서 전문가가 될 생각이 없다면 구매하지를 말아주세요. 부탁입니다."
285,Infinite Flight - 비행 시뮬레이터,공항 건물 추가 게임은 정말 훌륭한데 공항에 건물들이 없어서 많이 허전하네요~ 건물만 구현된다면 최고의 시뮬레이터가 될 것 같습니다.
286,Infinite Flight - 비행 시뮬레이터,최고 제가 본 모바일 시뮬레이터 중 최고입니다. 곧 나올 세계 맵이 나오면 이길 수 있는 건 없다고 생각됩니다
287,Infinite Flight - 비행 시뮬레이터,굳 근데 말티 할 때 돈 내고  30일은 에바라 돈 내면 계속할 수 있게 해 주세요
288,Infinite Flight - 비행 시뮬레이터,라이트 야간 비행할 때 랜딩 라이트 비춰주시고 칵핏이 너무 어두워서 안 보여요 라이트 좀 설치 부탁드립니다
289,Infinite Flight - 비행 시뮬레이터,겁나 꿀 잼 공항 건물 좀 만들어주세요 그리고 한글로 번역 부탁드려요
290,Infinite Flight - 비행 시뮬레이터,속도제한 350킬로에서 왜 계속 온 버핏이라는 말이 나오는 거죠
291,Infinite Flight - 비행 시뮬레이터,구매했던 기체랑 공항 구매했던 기체랑 공항들이 다 유료로 바뀌었네요 전까지만 잘했는데 이번에 업데이트하고 바뀌었는데 어떻게 좀 해주세요
292,Infinite Flight - 비행 시뮬레이터,이전 비전용 그런데 대기하는 비행기는 왜 없나요 그리고 비행기 다 공짜로 해 주세요
293,Infinite Flight - 비행 시뮬레이터,최고예요 돈을 쓴 만큼 재밌네요
294,Infinite Flight - 비행 시뮬레이터,오졌다 퀄리티 🖒그런데 멀티 샀었는데 지웠다 다시 까니까 멀티 구매가 안 돼있음
295,Infinite Flight - 비행 시뮬레이터,저기 다 좋은데 연기 추가 안 되나요?
296,Infinite Flight - 비행 시뮬레이터,초대박 꿀 잼 더 무 재미있어요!!! 제작자님 너무 존경해요!!!!
297,Infinite Flight - 비행 시뮬레이터,very good. shall be grateful if you will give them to add Korean. i beg you.
298,Infinite Flight - 비행 시뮬레이터, 새로운 항공기 좀 10종 추가 좀요!
299,Infinite Flight - 비행 시뮬레이터, Please add some airport buildings and some airport cars
300,Infinite Flight - 비행 시뮬레이터, Good BUT airplanes are vary expensve
301,Infinite Flight - 비행 시뮬레이터,ANTONOV AN225 MAKE THE ANTONOV AN255
302,Infinite Flight - 비행 시뮬레이터,So gooooooooddddd game It is the best simulation ever!!!
303,Infinite Flight - 비행 시뮬레이터,Good job 👍 너무나 좋음
304,Infinite Flight - 비행 시뮬레이터, exlent
305,Infinite Flight - 비행 시뮬레이터,좋아요 좋아요
306,Infinite Flight - 비행 시뮬레이터,모바일 중엔 최고! 비행기가 착륙할 때 바퀴가 육지에 다으면 막 흔들리게 해주세요. 모바일에서 구현하기 힘들겠지만 비행기가 땅에 달았는지 안 닿았는지 구별이 잘 안가네요...
307,Infinite Flight - 비행 시뮬레이터,윤정원 님 아 윤정원 님 아  300킬로 너트가 넘으면 실제로 엔진이 꺼진다든지 불난다든지 그럼 알고 말한 삼 이걸 over heat 라고 함
