,name,review
0,PUBG MOBILE, 제작자님 너무나 재밌고요 이거는 현질을 안 하면 할 수 없는 게 너무 많아요. 좀 줄여줬으면 합니다. ㅎㅎ
1,PUBG MOBILE, This game is f$#@ing perfact just add 8 squad pls and can you make team kills too?
2,PUBG MOBILE, 소리 가 너무 좋아 진짜 잘 어울리는 것 같아요. 업데이트할 때까지 계속 저는 기다리고 있습니다 그리고 저는 제가 좋아하는 것 같은 느낌이 들어요 안녕히 계세요 🇱🇷🇱🇷🇰🇷🇰🇷🇰🇷🇰🇷🇰🇷🇱🇷🇱🇷🇰🇷🇰🇷🇰🇷🇱🇷🇱🇷🇰🇵🇰🇵🌏😀🤲🙌
3,PUBG MOBILE, 넘날 고인물들이 많네(나도 고인 물 ㅋㅋ)
4,PUBG MOBILE, 엿 나라에는 아빠랑 피시방에서 했는데 모바일로 하니까 너무 좋아요.
5,PUBG MOBILE, Please add update to Android 0.9.1 I could give you five stars if you could let the Androids update
6,PUBG MOBILE, 가끔씩 죽을 때 로비로 가는 버튼이 안 떠요
7,PUBG MOBILE, Lovely game I loce it
8,PUBG MOBILE, The best game
9,PUBG MOBILE, 배그 열심히 할게요
10,PUBG MOBILE, 너무 재밌어요!!!
11,PUBG MOBILE, 업데이트된 거 너무 완벽
12,PUBG MOBILE, 세상에서 제일 재미있어요!!! 짱짱짱!!!😁
13,PUBG MOBILE, 게임이 안대요
14,PUBG MOBILE, 한국 서버랑 똑같아도 재미있어
15,PUBG MOBILE, Awesome!!
16,PUBG MOBILE, 한국어로 설정하는 거 어떡하나요? 제발요~
17,PUBG MOBILE, 다 좋은데 9.5버전 업데이트해주세요
18,PUBG MOBILE, 아주 재미있습니다.
19,PUBG MOBILE, 이 게임 추천
20,PUBG MOBILE, ada
21,PUBG MOBILE, 꿀 잼
22,PUBG MOBILE, Gut
23,PUBG MOBILE, SKRT SKRT
24,PUBG MOBILE, 엄청 좋다
25,PUBG MOBILE, 최고
26,PUBG MOBILE, 좋아요
27,PUBG MOBILE, 사 녹 맵도 생겨서 다 너무 좋은데 요즘 계속 classic 모드 하려고 게임에 들어가서 비행기 탈 때까지 기다릴 때 계속 앱 이 나가지고 다시 들어와도 나가지네요. arcade 모드는 괜찮네요. 근데 다른 사람들은 괜찮던데. 이거 최대한 빨리 고쳐주세요
28,PUBG MOBILE,
29,PUBG MOBILE, 안녕하세요 제가 제일 좋아하는 배틀그라운드를 만들어 주셔서 감사하고요 제가 원하는 거는 일단 총을 적한테 맞으면 핸드폰에 렉이 걸리네요... 예를 들어서 3뚝에 2레벨 갑옷을 입고 있었는데 적한테 우지 맞아서 렉이 걸려서 3대 맞고 죽었어요... 그리고 배틀그라운드를 패션 그라운드로 만들지 마시고 그거 만들 시간에 최적화 좀 빨리하세요... 그리고 현질 유도 좀 그만하세요... 물론 게임은 제가 하고 있는 게임 중에 최고입니다!!
30,PUBG MOBILE, 안녕하세요 개발자님 PUBG를 재미있게 하고 있는 한 유저입니다 제가 리뷰 드린 이유는 렉이 너무 심해서입니다 1킬을 아이 못합니다 갤럭시 6입니다 하지만 렉이 너무 심해서 친구랑 하면 욕을 먹습니다 게다가 그래픽을 최대로 낮 쳤는데도 렉이 심합니다 부탁드립니다
31,PUBG MOBILE, 인터넷 연결(핑) 표시를 원하는 위치에 옮길 수 있게 해주세요 게임할 때 인터넷 상태가 어떤지 확인하고 싶은데 보기 불편합니다
32,PUBG MOBILE, 한국어도 추가해주세요!! 다음 업데이트도 기대할게요!! ^♡^
33,PUBG MOBILE, 좋은 게임. 하지만 계정 호환 불가능.
34,PUBG MOBILE, 한국어넣어주세요...재발요...ㅠㅠ Korean spick
35,PUBG MOBILE, 잼 있어요 근데 클랜 이름 바꾸는 설정 좀 추가해주세요 Please add option for changing clan name . Thanks
36,PUBG MOBILE, 사 녹에 미라도가 없던데 왜 영상에는 있죠
37,PUBG MOBILE, 배그는 배그다 하지만 자극 전장이랑 컴배처럼만 좀
38,PUBG MOBILE, 앝!! 혹시 starting 이 뭐죠? 계속 떠여 너무 짜증 나서 남겨요 없애주세요
39,PUBG MOBILE, 러시아에서는 한국판 배그 설치방법 없나요
40,PUBG MOBILE, 제 인생에 최고의 게임입니다!! 이런 게임 만들어주셔서 감사해요
41,PUBG MOBILE, 저는 왜 고개만 움직이는 기능이 없을까요..?
42,PUBG MOBILE, Better than any games I've played I hope there will lots of more updates.
43,PUBG MOBILE, 아놔... 벌써 업데이트 시도 10번째다....
44,PUBG MOBILE," If I try to play pubg, it always saying 'Updating download list'. And then it says network connection error and then it says that I can't play this game because the version isn't the latest. Can you please fix this problem? I really want to play pubg. BUT THE GAME IS NICE..."
45,PUBG MOBILE, 저만 그런가요? 왜 업데이트 가 안되죠? 용량도 넉넉한대 왜 업데이트가 안되죠???오류임? 무지...
46,PUBG MOBILE, 말할 필요 없이 너무 재밌어요
47,PUBG MOBILE, Can you add Korean in the game? Why don't you add korean even though it is Korean game?
48,PUBG MOBILE, 너무 좋아요 그래픽도 좋고 로딩도 빠르고
49,PUBG MOBILE, 버그는 님들 핸드폰이 안 좋은 거예요 그리고 파는 언제 적 파냐
50,PUBG MOBILE, 저 좀 구글 기프티 카드 좀 주세요.....
51,PUBG MOBILE," why can't i play in my computer? i don't want to install emulator like nox so, work google!!!!!!!!!!           but i'll give you 5 star^^"
52,PUBG MOBILE, 개꿀 잼 겁나 재미있어요
53,PUBG MOBILE, 렉이 좀 심해서 아쉽지만 재미는 있어야
54,PUBG MOBILE, 나는 이 게임을 죽어도 계속하고 싶지
55,PUBG MOBILE, 너무 재미있어요 근데 문제는 해이 너무 많아요
56,PUBG MOBILE, 게임님 이 게임해주세요
57,PUBG MOBILE, GOOD 5 STARS FOR THIS.
58,PUBG MOBILE, 너무 재미있어요 그리고 빨리 좀비모드가 나왔으면 좋겠어요
59,PUBG MOBILE, 개꿀 잼 한번 해보세요
60,PUBG MOBILE, Good Game GG
61,PUBG MOBILE, 모바일 게임 이러게 잘 만든 거 오랜만에 봄
62,PUBG MOBILE, 제가 언어를 한국어로 모 가져요!
63,PUBG MOBILE, the goooooooood جيد جدن
64,PUBG MOBILE, 너무나 재밌고 웃김
65,PUBG MOBILE, i can't update this game
66,PUBG MOBILE, It is very fun. It is very nervous when there is foot print
67,PUBG MOBILE, 갸꿀잼
68,PUBG MOBILE, 정말 재미있게 잘 플레이하고 있습니다.
69,PUBG MOBILE, 최적화만 빨리빨리 해줌 최고 게임
70,PUBG MOBILE, 핵 꿀 잼 ㅇㅈ?
71,PUBG MOBILE, Good game
72,PUBG MOBILE, Very good
73,PUBG MOBILE, 렉 문제
74,PUBG MOBILE, 너무 재미
75,PUBG MOBILE, 개굴 잼
76,PUBG MOBILE, Is too fun and good updates!!!!!
77,PUBG MOBILE, 배그 왜 안 됨? 지우고 다시 깔면 됨?
78,PUBG MOBILE, 진짜 재미있음
79,PUBG MOBILE, 그냥 다 좋아요
80,PUBG MOBILE, 중독성 있는 게임
81,PUBG MOBILE, Good
82,PUBG MOBILE, 짱
83,PUBG MOBILE, Gooood
84,PUBG MOBILE, 갖게
85,PUBG MOBILE, 꿀 잼
86,PUBG MOBILE, 짱
87,PUBG MOBILE, GOARD
88,PUBG MOBILE, 꿀. 잼.
89,PUBG MOBILE, 재미.. 재미.. 개꿀!!!
90,PUBG MOBILE, 대박이네
91,PUBG MOBILE, 좋다 너무
92,PUBG MOBILE, 너무 좋아요
93,PUBG MOBILE, 네 좋아요
94,PUBG MOBILE, 아주 좋아요
95,PUBG MOBILE, Gg
96,PUBG MOBILE, 최최최최최고
97,PUBG MOBILE, 너무 좋네요^^
98,PUBG MOBILE, 대박이 애요!😈근대 핵 너무 많아요. 일해라 블루홀!!!!!!!!!!!!!😠😈👿👎👎👎👎👎💔
99,PUBG MOBILE, 배그 짱짱 짱짱 짱짱
100,PUBG MOBILE, 좋아요
101,PUBG MOBILE, 최고
102,PUBG MOBILE, 좋아요
103,PUBG MOBILE, 굿
104,PUBG MOBILE, 최고👍👍👍👍👍
105,PUBG MOBILE, 정말 좋아요!!! 킬링 정말재미있슼ㅋㅋ(제정신임 사이코 아님) 근대 이거 안 들어가죠요 ㅠㅠ 수정해주세요 ㅠㅠ 으ㅡ응어ㅓㅇ어어 저어떡해여어엉 삭제해야 하나요 ㅠㅠ
106,PUBG MOBILE, PUBG를 즐기고 있는 PUBG 빠돌이 입니다×o× 다~좋은데 업데이트 한 다음에 채팅방 이 조금 불편해요~~ 수정 부탁드립니다😊
107,PUBG MOBILE," HI I'm one of player enjoying a game, and thank you for making pubg mobile. I would like to tell you guys something. I like everything about this game but can you guys update things on computer like 8 people squad , new map , new guns and new grip and stuff lastly thanks you for making pubg"
108,PUBG MOBILE,
109,PUBG MOBILE, 반바지도 더 추가해 주시고 외국에서도 한국어 설정할 수 있게 해 주세요! ヾ(≧∀≦*) ﾉ〃
110,PUBG MOBILE, 용량이 너무 커.. 그래서 설치 안돼요 게다가이거땜에겜거이삭제함
111,PUBG MOBILE, 렉 너무 많이 걸리고 디스코드랑 같이 하면 둘 중 하나는 튕겨요 수정 점 부탁
112,PUBG MOBILE, It is really great but the thing is that right now update 0.8.0 is not up.I thought it was my phone with the problem but it wasn't it was nit posted sanhok map was not updated thank you but still it is a good game!
113,PUBG MOBILE, 비매너 유저가 너무 심해요 그런 유저들 밴좀 해주세요
114,PUBG MOBILE, 1인칭을 추가시켜주세요 서버 최적화도 많이 필요한 것 겉네요
115,PUBG MOBILE," This is the best game ever I actually played. I've been playing so many games like Clash Royale, but this is the best game anyways. 최고의 게임"
116,PUBG MOBILE, 너무 너 눈 너무 너 너 너무 재밌는데.. 사옥 맵은 언제 출시될까요? When is the map of 'Shanok' going to update ?
117,PUBG MOBILE, 다 괜찮은데 카구 팔을 연사하는 유저를 보았어요 핵 유저 좀 없애주세요 제발
118,PUBG MOBILE, 게임을 엄청 재밌게 하고 있어요 그런데 낙하산 탈 때 낙하산 안 펴고 그냥 내려가서 놀랐어요
119,PUBG MOBILE, 개꿀 잼 22랩 되면 개꿀 잼 kkkk
120,PUBG MOBILE, 이것보다 더 재밌는 배그는 없네욬ㅋㅋㅋㅋ
121,PUBG MOBILE, 역시 최신 핸드폰으로 업데이트하니까 로딩도 빠르고 즐거운 게임입니다.
122,PUBG MOBILE, 멀티플레이가 돼서 좋네요 핵꿀잼
123,PUBG MOBILE, 이거 자체가 글로벌 배그라서 한국어로 할 거면 한국계정으로 까세요 한국 배그
124,PUBG MOBILE, It's very very good game.
125,PUBG MOBILE, 클랜같이 들어갈 수 있게 패치 좀
126,PUBG MOBILE, Please add Korean.
127,PUBG MOBILE, PLZ ADD KOREAN LANGUAGE .
128,PUBG MOBILE, 업데이트가 pc버전이랑 비슷하게 되니까 너무 죠아용
129,PUBG MOBILE, 사 녹 출시 언제!?
130,PUBG MOBILE, 친구들이랑 같이 할 수 있어서 너무 좋고 재밌어요
131,PUBG MOBILE, 한국어로 안팎여요
132,PUBG MOBILE, GD!!
133,PUBG MOBILE, 너무 조와요
134,PUBG MOBILE, 무려 인생 게임이라고 할 수도 있겠다
135,PUBG MOBILE, 정말 재미있어요 최고 근대 오류 가 있어요
136,PUBG MOBILE, 좋고 재미있고 그래픽도 좋아요!
137,PUBG MOBILE, 다 좋은데 한국어가 없네요;; 한국어가 있으면 좋겠어요.
138,PUBG MOBILE, 꿀 잼
139,PUBG MOBILE, Fthe best game ever
140,PUBG MOBILE, Goodddddddddd
141,PUBG MOBILE, 최적화 좀.....
142,PUBG MOBILE, 밤새는 줄 모르고... 재밌다
143,PUBG MOBILE, 갓겜 인정? 어 인정
144,PUBG MOBILE, 갓겜
145,PUBG MOBILE, Good
146,PUBG MOBILE, 꿀 잼
147,PUBG MOBILE, 가꿀
148,PUBG MOBILE, 재미나네요
149,PUBG MOBILE, 짱짱 귯
150,PUBG MOBILE, 다 좋은데.... 놰 업데이트가 안돼요???
151,PUBG MOBILE, 굿
152,PUBG MOBILE, 제가 터키에서 살고 있는데 한국어 설정이 안 되나요? 그리고 터키는 와이파이가 제한되어있는데 용량 좀 줄여주세요ㅠㅠ
153,PUBG MOBILE," 정말 다 좋아요. 그런데 업데이트 시간이 너무 길어요. 제 폰이나 와이파이가 문제인지는 모르겠지만, 시간이 너무 느리네요"
154,PUBG MOBILE, 다 재밌긴 한데 상대들이 녹스나 블루스택으로 게임하는 것 차단할 수 있나요
155,PUBG MOBILE, 이거 자극 전 장인 가요? 일단 그래픽은 좋은데 모바일 배그랑 똑같은 거 같기도 하고..... 뭐죠 이거? 짝퉁인가요?
156,PUBG MOBILE, 15배율 추가 원합니다. 다른 건 다 괜찮고요. 그래픽도 모바일에서의 최상이네요
157,PUBG MOBILE, 한국어로 업데이트할 수 없어요? 만약 된다몀 한국어도 해주세요
158,PUBG MOBILE, 와우! 대박이네요. 모바일 배틀그라운드가 이 세상에서 최고입니다. 앞으로도 많은 업데이트 부탁드립니다. 파이팅!
159,PUBG MOBILE, 진짜 재미있음. 포트 나이트 보다 재미있음.ㅋㅋㅋㅋㅋ
160,PUBG MOBILE, 그냥 재밌네 컴퓨터로 하면 더 재밌을 듯
161,PUBG MOBILE, 한국 서버도 총 쏠 때 빨간 피 나오게 해주세요
162,PUBG MOBILE, 너무 재미있어요 제작자님 짱!!!👍👍👍 할 게임 없으면 강력 추천!!!!!
163,PUBG MOBILE, 친구 참 보면 하트가 있던데 하트 어떻게 주는 거예요?
164,PUBG MOBILE, 정말 재밌어요!
165,PUBG MOBILE, 업데이트 후 결제 오류 땜에 결제가 안돼요...
166,PUBG MOBILE, 저만 이거 쉽나요?(죄송...)
167,PUBG MOBILE, could you make a new server such as Australian server or Oceania server. thanks.
168,PUBG MOBILE, Is this Korean game?
169,PUBG MOBILE, I need korean
170,PUBG MOBILE, LIKE IT
171,PUBG MOBILE, Very nice
172,PUBG MOBILE, ㅎㅎ시노
173,PUBG MOBILE, 진짜 재미있어요
174,PUBG MOBILE, 꿀 잼
175,PUBG MOBILE, 개꿀
176,PUBG MOBILE, 개꿀
177,PUBG MOBILE, 굿
178,PUBG MOBILE, 굿
179,PUBG MOBILE, 굿
180,PUBG MOBILE, 제작자님 Ai가 뭐예요? 유튜브에서 막 ai 내 ai라고 막 나오고... 아무튼 안 알려주어도 괜찮지만 얘기를 해주면 좋겠습니다 감사합니다 이 게임 최고예요 파이팅
181,PUBG MOBILE, 한국판 pubg와 멀티를 할 수는 없나요? 답변해주시면 감사하겠습니다
182,PUBG MOBILE, 개발자님 수고가 많으십니다. 여쭤보고 싶은 게 있는데 아케이드로 플레이하면 왜 그 결과가 데이터에 표기가 안 되나요???
183,PUBG MOBILE, 저는 이 게임을 하는 유저인데요 갑자기 안된다고 하네요 그리고 한국어가 안돼요 제 닉네임은 이슈 휘고 이 점 좀 고쳐주세요
184,PUBG MOBILE, 혹시 미국에 사는데도 한국어판이 다운 가능하나요? 한국어로 찾아봐도 영어판만 나오네요 ㅠㅠ
185,PUBG MOBILE, 제가 요번에 페이스북 프로필 사진을 바꾸었는데 게임에서는 적용이 안되어 있어요. 빨리 해결해주시고 제 닉은 VKCunghee이에요.
186,PUBG MOBILE, 진짜 배그 처럼 느껴지네요~^^ 다 좋습니다 운영자님 마지막으로 언어에 한국어도 추가해주시면 완벽할 것 같습니다
187,PUBG MOBILE, 다른 건 다 좋은데 핑이 왜 이렇게 튀나요 남아공에 살아서 유럽서 저를 쓰고 있긴 한데요 멀어서 평 200 정도 아니면 190 정도 나오는데 요즘 들어 핑이 자꾸 올라갔다 내려갔다가 하는 현상이 심한데 이거 왜 이러는 건가요 예전엔 괜찮았는데
188,PUBG MOBILE, 기가 막히네... 근데 해외에 사시는 분들을 위해 한글 있으면 더 좋을 듯 (저 포함ㅋ) ㅠ.ㅠ
189,PUBG MOBILE, 아우 쌌다 베이베~♡ 그래픽 지리고 컨트롤 편하고 거의 뭐 pc 배그랑 동급 ㅗㅜㅑ
190,PUBG MOBILE, 와... 그냥 만들어주셔서 감사하다는 말밖에 안 나오네요. 감사합니다.
191,PUBG MOBILE, 다른 건 좋은데 렉을 안 걸리게 하는 방법이 있나요? 렉이 많이 걸려서 이걸 없앨 수 있는 법이 있으면 좋겠네요 배틀그라운드 재미있게 하는 유저입니다^^
192,PUBG MOBILE, 너무너무너무 재미있어요!!!!! 모바일 배그도 만들어주셔서 감사해요❤
193,PUBG MOBILE, 제가 이 게임 업데이트하려고 했는데 제 facebook 개정이 날아가죠?
194,PUBG MOBILE, 여러분 AI는 인공지능 즉 로봇입니다 사람들이 많이 접속하면 실제 사람들과 하겠지만 사람들이 적으면 빈자리를 채우는 게 AI(인공지능)입니다
195,PUBG MOBILE, ??좌우 기울여 쏘기 되는데요 ㅋㅋㅋㅋㅋ 테드 TV 가셔서 영상 보고 오세요 그 솔로 1등인가 그 영상에 있음 거기서 컨트롤 관련된 부분 찾아서 똑같이 하면 생김
196,PUBG MOBILE, 한글 페치 부탁드려요 외국에서 유학 중인데 글로벌뿐이 못해요
197,PUBG MOBILE, 다음 업데이트에는 50 대 50모드가 생겼으면 좋겠어요 그럼 진짜 완벽할듯하네요
198,PUBG MOBILE, 다 좋은데 일인칭을 추가해 주셨으면 해요 정말 갓 게임입니다. 만들어주셔서 감사합니다
199,PUBG MOBILE, 하.... 제가 베트남으로 여행 왔는데.. 한국어가 없네요..... 이 점 빨리 고쳐주시면 감사하겠습니다.
200,PUBG MOBILE, 음 개임을 버그 좀만 수정하면 좋을겄갔네요
201,PUBG MOBILE, 근데 어떻게 한국어로 답글 해요?
202,PUBG MOBILE, 업데이트 많이 많이 해주세요 해외에서도 게임 플레이 되게 해주세요
203,PUBG MOBILE, 배그 컴퓨터에 하는 건 비싸서 못했는데 공짜 모바일로 나오니까 너무 좋아요.
204,PUBG MOBILE, 한국 배그 m 은 어디서 다운로드할 수 있나요?
205,PUBG MOBILE, Pubg is famous in United states. How about your contry?
206,PUBG MOBILE, 굉장히 재밌음 시간 가는 줄 모름
207,PUBG MOBILE, 게임 일 안깔러조요ㅠㅠㅠㅠ 제발 😖😖😖😖😖😖
208,PUBG MOBILE, ㄹ극느븐ㄱㆍㅂ늨
209,PUBG MOBILE, 한국어 부탁드립니다 감사합니다 감사합니다 감사합니다 꾸벅
210,PUBG MOBILE, 이거 좋은데 한국어 지원 빨리해주세요
211,PUBG MOBILE, Nice game good good ya
212,PUBG MOBILE, 다 좋은데 가짜가 있나요?
213,PUBG MOBILE, E muito bm
214,PUBG MOBILE, 개 꿀 잼이에요
215,PUBG MOBILE, 배그 한글로 바꿔 주세요
216,PUBG MOBILE, It is very fun game to play
217,PUBG MOBILE, 우와 게 잼
218,PUBG MOBILE, 검나 검나 검나 검나 검나 진짜 꿀 잼
219,PUBG MOBILE, 만들어 주셔셔 감사합니다
220,PUBG MOBILE, Ultra HD waiting for it :)
221,PUBG MOBILE, 재미있어요!
222,PUBG MOBILE, 짱
223,PUBG MOBILE, Wow
224,PUBG MOBILE, 너무 재미있어요!!!!!!!!!!
225,PUBG MOBILE, 최고의 게임
226,PUBG MOBILE, 좋아요
227,PUBG MOBILE, 굿
228,PUBG MOBILE, 좋아요
229,PUBG MOBILE," 개발자님, 저는 지금 배그 m을 즐겁게 플레이하고 있습니다. 하지만 한국 배그 m에 궁금한 점이 있습니다. 첫째, 게임은 카카오로 출시되나요? 둘째, 중국 서버 계정이 그대로 있나요? 셋째, 로그인은 위챗과 큐큐로 로그인되나요? 넷째, 일인칭, 유리창도 그대로 있나요? 다섯째, 또 업데이트하실 생각은 없나요? 좋은 의견 부탁드립니다."
230,PUBG MOBILE, 엄청나게 재미있어요. 근데 이게 완전히 pc 게임과 거의 흡사했으면 좋겠네요.ㅎㅎ 하지만 그래도 재미있어요. 근데 하나 당부할 점이 있어요. 렉이 좀 심하네요. 그리고 핵 사용자가 점점 늘어나고 있어요. 모든 게임에 핵이 없기를~~ 그럼 안녕히 계세요. ㅂㅇㄹ
231,PUBG MOBILE, 모바일 배그 최고! 최근 짝퉁 배그들만 보다 이런 거 보니 눈도 정화되고 너무너무 재밌는 건 물론 한국판 빨리 나오면 좋겠네요 게임 정말 재밌습니다 제작자님 사란 합니다 파이팅
232,PUBG MOBILE," 제가 폰이 낮긴 하지만 그래도 그래픽 최하인데도 불구하고 가끔 중간에 소리가 삐ㅡ익, 삐삑...하면서 렉이 걸려요... 그래픽을 많이 개선하시는 게 겁나 필요해요... 제발 무엇보다도 그래픽을 제발 개 많이 개선브탁드림"
233,PUBG MOBILE, Kevin Lee 님 아이폰과 게임 플레이가 안된다고 하시는 거 같은데 아이폰은 아직 최신 버전 0.4.0 버전이 호환이 되지 않아 같이 플레이를 못하는 걸로 알고 있습니다. 문의해보니 곧 아이폰도 최신 버전으로 업데이트가 가능해진다고 하네요.
234,PUBG MOBILE, 진짜 꿀 잼이에요 5월 16일에 한국 배그 m 출시 기대할게요!! 한국 배그 m은 업데이트 빨랑빨랑해서 중국어 버전을 빨리 따라가 길..
235,PUBG MOBILE, 정말 좋아요!! 근데 핵 안 썼는데 핵 썼다고 오해받아서 영구 정지 먹었어요... 빨리 한글 배그 m 나와서 그걸로 할 수 있는 날이 빨리 왔으면 좋겠네요! 텐센트! PUBG FIGHTING!
236,PUBG MOBILE, 정말 다 좋은데 여러 가지 맵이 생겼으면 좋을 거 같고요 이개 핵 유저가 많아요 그래서 좀 그것만 고쳐주시면 좋을 거 갇내요 감사합니다!~~~♥♥
237,PUBG MOBILE, 님들아 4월 24일에 한국에 정식 출시해서 먼저 베타 버전에 돌입하고 5월 중반에서 6월 초반에 베타 끝나고 모두가 즐길 수 있습니다 ㅎㅎ 펍 지란 텐센트에서 공식 발표했습니다 지금 카운트다운 되고 있고요. 24일에 아침 6시에 베타 시작해요 아셨죠??
238,PUBG MOBILE, 모바일이라 사람이 없는 건 안대 ㅋㅋㅋㄱㄱㄱㄱ 뭘 안다는 거야 폰 게임에 100명이서 멀티 돌리면 서버 터지니까 그런 거지 ㅋㅋㄱㄱㄱ 알고 말해라 좀
239,PUBG MOBILE, 한국은 vpn 켜서 접속이 가능하고 아시아 서버로 바꾸면 vpn을 따로 안 켜도 됩니다. 배그 갓겜 4월 25일에 한국 버전 기대할게요!!! 블루홀 텐센트 펍 쥐 파이팅!!!!!!!!
240,PUBG MOBILE," With this new updated patch, unable to play with my friends who are using iphones because they simply cant undate to new version... When will the new version for iphones be released? Im like a wolf stranded alone away from the pack.. very lonesome"
241,PUBG MOBILE, 레알 ★갓☆게임★ 진짜 게임 잘 만듦 하지만 한국어도 좀 추가 좀.. 이거 이상한데 왜 안드로이드랑 아이폰은 같이 안됨?
242,PUBG MOBILE, 좋아요! 배그 잘 옮기셨네요. 거의 하스 x 톤 모바일급 혁명이네요 내일 나오는 한국 서버 기대가 됩니다 d (^~^d
243,PUBG MOBILE, 진짜 재 인생 게임입니다♡ 운영자님 사랑해요❤ 근데 업데이트했을 때 97프로까지 됐는데 깁자기 오류가 계속 떠여..ㅠㅠ
244,PUBG MOBILE, 게임 아주 재미있네요 ㅎㅎ 그런데 곧 있으면 배틀그라운드 m 한국판이 나오는 데 이 글로벌 버전에서 해왔던 것 들이 한국판에서 연동이 되나요? 페이스북 계정으로 로그인했는데......
245,PUBG MOBILE, 저 갑자기 잘 되다가 튕기던데 무슨 일인가요? 그리고 저는 한국에서 사는데 배그 m을 사전예약하려고 하는데 그 나라에서 허용되지 않는다고 하는데 무슨 일인가요?
246,PUBG MOBILE, 다 좋은데 업데이트가 자꾸 끊기네요.ㅠㅠ
247,PUBG MOBILE, 솔로가 제일 쉬워요. 스쿼드는 트롤들이 많아서...
248,PUBG MOBILE, PC 배그에서처럼 오세아니아 서버도 언젠가 생겼으면 좋겠네요 :) 아시아에서 하면 그나마 좀 괜찮은 수준이지만 다른 서버에선 핑이 너무 안 좋습니다
249,PUBG MOBILE," 버그가 계속 걸려가지고 초반에 바닥 밑으로 빠지고, 건물이 초반에 이상해서 파밍 하기가 좀 어렵다."
250,PUBG MOBILE, 랙이 좀 걸리네요... 하지만 한국 서버가 없어서 그런 거니까 이해해요!!!
251,PUBG MOBILE, 정말 다~~♡♡♡좋습니다 하지만 s9 정말 좋은 폰으로도 불과하고 전 렉이 조금씩 있습니다 그리고 자극 전 장 중국 서버처럼 업데이트가 되면 좋겠어요 이것들만 개선해주신다면 전 세계 1등 갓겜으로 자리를 지킬 수 있을 것 같습니다
252,PUBG MOBILE, 정말 꿀 잼!!! 이거 영어라서 더 싶고 정말 고퀄리티!!! 이 게임은 거의 1등 정도 곳 한국 서버도 나오는데 정말 기대가 커요!!!!
253,PUBG MOBILE, 안녕하세요 캐나다에서 현재 모바일 배그를 플레이하는 유저입니다 페이스북을 보아하니 오늘 오전 10시에 한국 배틀그라운드 m이나 온다는 소식을 들었습니다 그래서 궁금한 점이 있는데 캐나다에서도 한국 모바일 배그를 다운로드할 수 있는지 궁금하네요 답변 부탁드립니다^^
254,PUBG MOBILE, 너무 재미있는데 저만 렉이 걸리나요?? 저는 잘 되는데 조준을 하면 렉이 걸리는데 엄청 재미있네요
255,PUBG MOBILE, 할 수 있는 한 사소한 것까지 완벽히 pc와 같이 만들어주세요 tencent!!! 부탁드립니다 ^^
256,PUBG MOBILE, 계속 서버가 튕기네요 아무래도 북미 서버가 터진 거 같아요 확인부탁드려요ㅠㅠ
257,PUBG MOBILE," 엄청 즐기고 있는 게임인데요, 사람을 죽일 때나 피할 때마다 렉이 너무 먹어서 도망가는데 그냥 죽을 때도 있고 레벨 3 아머 입고 있어도 M416에 3방 맞으면 그냥 죽더라고요. 처음에는 내가 못하는 줄 알았는데, 렉이 걸리기 시작하면서부터 승리도 못하고 한 명도 못 죽일 때가 많아졌습니다. 이것 좀 고쳐주세요."
258,PUBG MOBILE, 아시아 서버 의외로 핑이 20까지 뜨네요
259,PUBG MOBILE, 다 좋은데 왜 랙이 걸리는지 모르겠어요ㅜㅜ 한국 버전도 나온다는데 언제나 오나요?
260,PUBG MOBILE, 통곡의 다리에 있는 트럭에 끼어있는 버그가 있어서 죽었어요
261,PUBG MOBILE, 만약에 다시 업데이트하면 그땐 한국어 번역도 추가해 주세요
262,PUBG MOBILE, 음 로그인할 때 서버가 바쁘다 내용 ㅡ.ㅡ 그래서 접속 안됨
263,PUBG MOBILE, 이 게임은 갓 게임입니다! 꼭 해본 새여😄 한가지 안 좋은 게 있다면... 왜! 한국 버전은 출시를 미룬 거야! 으흠... 한국 버전 출시가즈아ㅏㅏㅏㅏㅏ!!!!😅😎😎😎😎😎
