,name,review
0,Stickman Hook," 현금▷카지▷노 🔥 M Χ M 2 １ , ℂ 0 'Ⅿ 🔥 전에 업데이트에 매치 설정이 바꾸셨길래 뭐지? 하고 넘겼는데 제가 실버 3773이거든요. 그런데 실버인데 매치를 하면 랭크가 높은 사람들이 많이 서버에 들어와서 게임이 너무 어려워요. 진짜 다른 건 다 좋은데 랭크가 같은 사람들이랑 하는 게 좋아요. 그래서 낮은 랭크인데 핵을 쓰는 유저들이 많아요"
1,Stickman Hook, 이 게임 정말 재미있긴 한데 제가 지금 445단계이거든요. 근데 올라가도 큰 차이가 없어요. 난이도가 다 비슷해요 그리고 캐릭터도 더 만들어 주세요
2,Stickman Hook, 게임 자체는 잘 만들었습니다 그러나 광고가 너무 많습니다. 이 점은 와이파이를 끄면 되지만 너무 번거로운 점이 있어 광고를 자제해주셨으면 좋겠습니다 +같은 곳에서 튕기다 보면 엄청 빨라지는 거 의도한 건가요?
3,Stickman Hook, 이건 레알 게 꿀 재이다 광고가 만지만 와이파이 끄면 되니까 괜찮아요 그리고 중독성 쩔고 밖에서 시간 때 우거나 기다리거나 할 때 하면 좋을 듯. 굳!
4,Stickman Hook, 진짜 핵잼꿀잼이고 진짜 재미있는데 캐릭터를 도 다양하게 해줬으면 좋을 거 같아요 광고도 다 보고 캐릭터 다 얻었는데 더 새롭고 신기한 캐릭터가 추가됐으면 좋겠네요! 그럼 좋은 시간 보내세요~!
5,Stickman Hook, 버그 땜에 65단계 통과가 안됐어요;; 너무 멀리 위로 날아가서 골인 지점까지 들어갔는데 죽더라고요 버그 좀 고쳐주세요
6,Stickman Hook, 이 게임 순위 없나요? 있으면 좋을 거 갔습니다. 참고로 800 단계 초반임
7,Stickman Hook, ㅋㅋㅋㅋㅋㅋㅋ 은근 재미나네..... It is fun! Good for passing time!!
8,Stickman Hook, 어제 깔았는데 지금까지 이 게임에만 빠저있어요ㅋㅋㅋㅋㅋㅋ 하는 방법도 간편하고 아주 쉬운 게임이에요 날아다닐 때는 스파이더맨 깉은느낌이 들어요 아주 재미있는 게임이에요 그러니까 다른 사람들도 지금 해보세요!
9,Stickman Hook, 캐릭터 좀 더 늘려주세요 캐릭터가 다 있어서 할 맛이 않나요
10,Stickman Hook, 이거나 샀을 때가 어 잰대 고수됨 어렵게 만들어주시고 캐릭터 좀 추가요
11,Stickman Hook," 정말 재밌어요 근데 광고 좀 줄여주세요. 깨거나 떨어지면 계속 나와요,"
12,Stickman Hook, 재밌긴 재밌는데 중독성이 강해요 ㅋㅋ 엄마가 영아 일기 써라고 하면 응 해놓고 이 게임만 해요 ㅋㅋ
13,Stickman Hook, 다른 게임 하고 비교가 안 봼
14,Stickman Hook, 그럼 와이파이를 꺼야죠 조금 있으면 광고 안 뜨는데....
15,Stickman Hook, 재미있네요 그런데 맵의 모양이 좀 비슷한 것 같아요
16,Stickman Hook, 개꿀 팁 와이파이 끄고 하면 광고 안 나옵니다 걔 꿀~
17,Stickman Hook, 이거 재미없다고 한 사람 거짓말임 개꿀 잼!
18,Stickman Hook, 처음에 500만 명이라 해서 깜짝 놀랐습니다
19,Stickman Hook, 이거 너무 어렵지도 않고 재밌어요
20,Stickman Hook, 장애물을 추가하면 좋을 거 같아요 그래도 굿!!
21,Stickman Hook, 이건맟차가지로재미있
22,Stickman Hook, 심심할 때는 이 게임해보세요
23,Stickman Hook, 환불해주세요 실수로 눌러버렸어요
24,Stickman Hook, 어제 시작했는데 167단계 ....ㄷㄷ 중독성
25,Stickman Hook, 이 게임 너무잼있엌ㅋㅋ
26,Stickman Hook,
27,Stickman Hook, 너무 재밋!! 스파이더맨 흡사!
28,Stickman Hook, 아주아주 재미있게 플레이하고 있습니다 근데 계속 플레이하면 가끔씩 버그가 걸립니다
29,Stickman Hook, 스윙스타 따라 하네
30,Stickman Hook, 다 좋은데 이번 업데이트로 가지고 있던 캐릭터가 다 없어졌어요 복구할 수 있으시면 해주세요
31,Stickman Hook, 이거 짝퉁이라는 사람 누구냐
32,Stickman Hook, 재밌게 잘 하고 있습니다. 데이터 끄니까 광고도 하나도 안 나오고 좋네요 ㅎ
33,Stickman Hook, 좋아요!! 재밌어요^^/
34,Stickman Hook, 재미네ㅋㅋㅋㅎㅎㅎㅈㅅ
35,Stickman Hook, 아이디어 ㅁㅊ 최고다
36,Stickman Hook, 겁나 재미있어요
37,Stickman Hook, 광고 좀 줄여주세요
38,Stickman Hook, 캐릭터를 스파이더맨으로 하면 더 좋을 것 같아요
39,Stickman Hook, 귀엽고 재밌어요 왕으로 플레이하고 있는 플레이어입니다
40,Stickman Hook, 다른 사람과 대결이나 pvp를 못 한다는 게 아쉽지만 정말 재밌어요! 추천합니다♡♡♡♡
41,Stickman Hook, 음악을추가하면젛을것닽읍니당
42,Stickman Hook, 저 스트레스 안 받는 게임이 이게 최고예요
43,Stickman Hook, 평가를 해도 계속해달라는 창이 계속 뜨는 거 이외엔 좋아요.
44,Stickman Hook, 레벨이 올라가도 난이도가 똑같음
45,Stickman Hook, 뒤로도 가고 막장 재미있는 게임 같아요
46,Stickman Hook, 광고가 너무 많은 것 같아요 광고 조금만 줄여주심 안돼요?
47,Stickman Hook, 너무 좋아요 근데 광고가 많고 난이도가 비슷해요
48,Stickman Hook, 간단하고 재밌어요
49,Stickman Hook, 정말 게임이 알차게 짜여있다
50,Stickman Hook, 컨트롤은 어려워서 더 재미있어요 이 게임 추천함
51,Stickman Hook, 캐릭터를 추가하면 더 좋을 것 같아요.
52,Stickman Hook, 다른 게임도 만들어주세요
53,Stickman Hook, 14스테이지 어떻게 해야 하나요
54,Stickman Hook, 엄청 꿀 잼 스파이더맨 개임
55,Stickman Hook, 대아 진아 진자 재밌다
56,Stickman Hook, 역시 인기 게임 2위라 제미이습니다
57,Stickman Hook, 이거 좋아요!
58,Stickman Hook, 너무 재미있어요!
59,Stickman Hook, 이거 근데 캐릭터 reach level5라 뜨며 캐릭터 설정이 안됩니다 하하하...
60,Stickman Hook, 단순하게 재미나네요
61,Stickman Hook, 정신없긴 한데 꿀 잼
62,Stickman Hook, 앱이 않겨 저요
63,Stickman Hook, 이거 개조
64,Stickman Hook, 간단하고 재밌어요
65,Stickman Hook, 제작자님 이거 끝이 어디죠?
66,Stickman Hook, 정말 꿀 잼!!
67,Stickman Hook, 갓겜찾았다!!
68,Stickman Hook, 아주 좋아
69,Stickman Hook, WOW BEAUTIFUL!
70,Stickman Hook, 와 이거 진짜 최고임 한 번씩 해보세
71,Stickman Hook, 너무 재미!!
72,Stickman Hook, 꿀 잼!!
73,Stickman Hook, 좋다!
74,Stickman Hook, 진짜 개꿀 잼임
75,Stickman Hook, 짱 진짜 꿀 잼
76,Stickman Hook, 너무 재밌어요.
77,Stickman Hook, 정말 재미있어요 안 깔면 후회합니다
78,Stickman Hook, 너무 좋아요
79,Stickman Hook, Good!!!!!!
80,Stickman Hook, 재밌어요!!!~
81,Stickman Hook, ㅏㅇㅇㅇ Djdnjec
82,Stickman Hook, it's good
83,Stickman Hook, 김정범 바보 되지 인정
84,Stickman Hook, 꿀 잼 캐릭터 재미있어요 GOOD!!
85,Stickman Hook, 너무 재밌어!!!
86,Stickman Hook, 좋고 재밌네요.
87,Stickman Hook, 재미있는 깨임
88,Stickman Hook, 생각보다 재밌다
89,Stickman Hook, 엄청 재미있어요
90,Stickman Hook, 재밌어욥ㅎㅎㅎㅎ
91,Stickman Hook, ㅅ 재밌어요
92,Stickman Hook, 진짜 시간 때우기 좋은 게임
93,Stickman Hook, 개꿀 띄
94,Stickman Hook, Good jab
95,Stickman Hook, 갸꿀띠
96,Stickman Hook, 좸있따
97,Stickman Hook, 재미나네
98,Stickman Hook, 착실한 마법사
99,Stickman Hook, 너무 재밌어요
100,Stickman Hook, 재미있네요
101,Stickman Hook, 해보면 재밌음
102,Stickman Hook, 갸꿀잼
103,Stickman Hook, 짱 잼
104,Stickman Hook, 정말 재밌어요
105,Stickman Hook, 꿀잼각
106,Stickman Hook, 재밌네요
107,Stickman Hook, GOD GAME
108,Stickman Hook, 아주 재밌어요
109,Stickman Hook, 개꿀 잼
110,Stickman Hook, Ok good
111,Stickman Hook, 정말 재밌어요
112,Stickman Hook, 꿀 잼 게임
113,Stickman Hook, 꿀 잼👍 시간 때우기 최고!
114,Stickman Hook, 이건 최고의 게임이다
115,Stickman Hook, 섹시해
116,Stickman Hook, 너무 재미
117,Stickman Hook, 광고 그만
118,Stickman Hook, 재미있어요 ^^
119,Stickman Hook, 심심할 때 하기 좋네요
120,Stickman Hook, 간단하며 재미있다
121,Stickman Hook, 심심할 때 하면 좋아요
122,Stickman Hook, 재미가 있어요 짱
123,Stickman Hook, 나 잼 아님 꿀 잼 게임
124,Stickman Hook, 커트론이 재밌다
125,Stickman Hook, 좋은 게임
126,Stickman Hook, 정말 재밌다
127,Stickman Hook, 엄청 잘) 만들었네요
128,Stickman Hook, 정말 아주 좋아요. 거
129,Stickman Hook, 광고.. ㅜ
130,Stickman Hook, 이거 링 쉽고 꿀 ^^
131,Stickman Hook, 오오오 오옹
132,Stickman Hook, 재미있어요!
133,Stickman Hook, 우와
134,Stickman Hook, ㅇ ㅋㅋㅋ
135,Stickman Hook, 너무 재미있어요.
136,Stickman Hook, 너무 재미있다
137,Stickman Hook, 아주 재미있어요
138,Stickman Hook, 넘나 재미있는 것
139,Stickman Hook, 쿠루 루루 잼
140,Stickman Hook, 재미있는 게임이다
141,Stickman Hook, 엄청재미었요
142,Stickman Hook, 완전 재미있어요
143,Stickman Hook, 정말 재미있다
144,Stickman Hook, 광고만 많음
145,Stickman Hook, 혼나 재밌음
146,Stickman Hook, 꼭 하세요 추천
147,Stickman Hook, 좋아요
148,Stickman Hook, 죔죔
149,Stickman Hook, 굴 잼
150,Stickman Hook, 갓겜
151,Stickman Hook, 나 잼
152,Stickman Hook, 짱
153,Stickman Hook, 꿀 잼
154,Stickman Hook, 꿀 잼
155,Stickman Hook, 짱
156,Stickman Hook, 꿀 잼
157,Stickman Hook, 대단해요
158,Stickman Hook, 쫭쫭
159,Stickman Hook, good
160,Stickman Hook, 사랑해
161,Stickman Hook, 잼
162,Stickman Hook, 짱임
163,Stickman Hook, good
164,Stickman Hook, 꿀 잼
165,Stickman Hook, GOOD
166,Stickman Hook, 꿀 잼
167,Stickman Hook, good
168,Stickman Hook, 꿀 잼
169,Stickman Hook, 평가할 때...
170,Stickman Hook, 잼
171,Stickman Hook, Good
172,Stickman Hook, 꿀 잼
173,Stickman Hook, Zz
174,Stickman Hook, 짱
175,Stickman Hook, Rtg
176,Stickman Hook, 잼
177,Stickman Hook, 이 예에 에에 에에에 에에
178,Stickman Hook, 굿!
179,Stickman Hook, 최고!
180,Stickman Hook, 최고!
181,Stickman Hook, 아주 재미있어요~^^
182,Stickman Hook, 좋아요!
183,Stickman Hook, 정말 정말 재밌어요💕
184,Stickman Hook, 어.... 그냥 재미있어요
185,Stickman Hook, 심심할 때 하면 좋을만한 게임 핵꿀잼👍👍👍👍👍👍👍👍
186,Stickman Hook, 굳
187,Stickman Hook, 꿀 잼이고 재미있어요. 별 ㄹ개(☆☆☆☆☆)
188,Stickman Hook, 최고의 게임
189,Stickman Hook, 재미있었어요
190,Stickman Hook, 최고다
191,Stickman Hook, 완전 꿀 잼
192,Stickman Hook, 굿 d
193,Stickman Hook, 재미있는 게임
194,Stickman Hook, 사랑해요
195,Stickman Hook, 재미있네요
196,Stickman Hook, 재미있다
197,Stickman Hook, 굿
198,Stickman Hook, 쯔쯔쯔
199,Stickman Hook, GG
200,Stickman Hook, 굳
201,Stickman Hook, 정말☆☆☆♡^^
202,Stickman Hook, 최고입니다^^♡
203,Stickman Hook, 재미있다. . .
204,Stickman Hook, 좋아요 👍
205,Stickman Hook, 굿
206,Stickman Hook, 좋아
207,Stickman Hook, 좋음
208,Stickman Hook, 좋아요
209,Stickman Hook, 굿
210,Stickman Hook, 최고
211,Stickman Hook, 굿
212,Stickman Hook, 최고
213,Stickman Hook, 굿
214,Stickman Hook, 굿
215,Stickman Hook, 최고
216,Stickman Hook, 굿굿
217,Stickman Hook, 굿굿
218,Stickman Hook, 좋아요
219,Stickman Hook, 굿
220,Stickman Hook, 굿
221,Stickman Hook, 좋아좋아
222,Stickman Hook, 정말 재밌고 시간 날 때 한 번씩 함..ㅎㅎ설치안하면 후회함... ㅋㅋㅋ 레벨이 높아질수록 완전 재밌음.!!!!
223,Stickman Hook, 저는 광고 많이 나올까 봐 Wi-Fi를 끄고 게임을 했는데요. 광고도 안 나오고 많이 좋아요!!! (저희 집은 Wi-Fi 터지던데) 별 100000000개!!!!!
224,Stickman Hook, 재밌어요 하지만 광고가 많이 나오네요 ㅠㅠ 그 점만 고치면 5점도 더 드리고 싶네요
225,Stickman Hook, 광고 좀 없애주라 뭐 하는 거냐 260판째 하는 중인데 광고가 2판에 한 번씩 뜬다 진짜 광고만 아니면 진짜 퍼펙트게임인데
226,Stickman Hook, 이거 광고않볼려면 와파 끄고 하세요 알고 보면 게꿀핍팁입니다
227,Stickman Hook, 겁나 재미있음 근데 살짝. 짜증 남 리뷰를 길게 남기고 싶지 않음 ㅂㅂ
228,Stickman Hook, 완전히 중독돼요!!!!! 재미난 게임 많아 만들어주세요ᄒᄒᄒ
229,Stickman Hook, 와우짱 그런데 왜 중간에 캐릭터가 없어지나요
230,Stickman Hook, 이거 처음에는 재밌는데 150~200단계 가면 질려요
231,Stickman Hook, 캐릭터 좀 더 만들어주세요
232,Stickman Hook, 졸라맨이 구체적으로 캐릭터가 잘 나와있어서 더 재밌어요
233,Stickman Hook, BGM만 있었으면 정말 완벽할 만큼 재미있는 게임 웃긴 상황이 많이 나오고 중독성이 나름 있습니다 재미있네요 ㅋㅋㅋㅋㅋㅋ
234,Stickman Hook, 플레이하기도 쉽고 장점 1:캐릭터 가 세 절 귀인데 캐릭터에 능력 좀 넣어주세요
235,Stickman Hook, 저희 반 담임선생님이 수학선생님이신데 이 게임 보고 각을 구해서 하는 수학적인 게임이래욬ㅋㅋㄱ
236,Stickman Hook, 광고가 좀 있네요... 그래도 존 잼이나 거 인정할게요
237,Stickman Hook, 다 좋은데 캐릭터 마다 능력치가 있었으면 좋겠습니다
238,Stickman Hook, 좀 더 많은 맵 종류가 있어야 합니다...
239,Stickman Hook, 짜증 나지 않고 점수가 안 나오는 게임이 좋은데 안 나와서 덩말좋아용
240,Stickman Hook, 이런 게임이 또 나왔으면 좋겠네요~~^^
241,Stickman Hook, 광고 좀 줄여주세요ᅲᅲ
242,Stickman Hook, 스파이더맨 스킨을 만들어주시면 최고있겄같아요
243,Stickman Hook, 너무 좋아요! 그리고 캐릭터 너무 귀여워요ᅮ
244,Stickman Hook, 광고 좀 줄여주세요
245,Stickman Hook, 너무 재미있어 오
246,Stickman Hook, 재미있는데 광고를 줄여주시면 더 좋을 것 같아요
247,Stickman Hook, 재밌어요 중독성도 있고 근데 최고 레벨이 언제예요?
248,Stickman Hook, 업데이트로 캐릭터 스킬을 만들어 주세요!!!
249,Stickman Hook, 개꿀 광고만 없애줘요
250,Stickman Hook, ㅛ뎌ㅛ교겨교ㅗㄱ
251,Stickman Hook, 재밌어욯ㅎ 러브러브
252,Stickman Hook, 재밍 써 옹ㅎ~ㅎ
253,Stickman Hook, super good!!!!!
254,Stickman Hook, I want more characters.
255,Stickman Hook, 굳굳ㅋ 근데 캐릭터가 계속 없어짐...
256,Stickman Hook, 재미있음 ㅋㅋ 진짜로
257,Stickman Hook, 광고가 좀 많음
258,Stickman Hook, 스킵 광고 없애주세요~~~ 누가 계속 광고 보고 넘겨요
259,Stickman Hook, 선전 싫어 ㅠㅠ
260,Stickman Hook, 꿀 잼이다!!
261,Stickman Hook, 랙이 심사요
262,Stickman Hook, 캐릭터 업데이트 필요
263,Stickman Hook, 대박남ㅇㅈ?
264,Stickman Hook, Very good very good
265,Stickman Hook, good!
266,Stickman Hook, 와는 잼=완전 재밌음
267,Stickman Hook, 👍애요 유튜브에 올려어요♥제 친구가
268,Stickman Hook, 이거 보신 분 꼭 까르삼
269,Stickman Hook, 꿀 잼
270,Stickman Hook, 깔자마자 업데이트 그는 도덕 책
271,Stickman Hook, 다 좋은데 스킨이 선택 안돼요
272,Stickman Hook, 이겜갓갬이다!!!!!!!!!!!!!!!!!!!!!!
273,Stickman Hook, 시간 날 떼 하면 재미있을 것 같음!!
274,Stickman Hook, 재밌고 간단하다
275,Stickman Hook, 재미있는 게임임
276,Stickman Hook, 아이들이 좋아해요
277,Stickman Hook, 정말 재밌어요
278,Stickman Hook, 다 재밌고 좋은데 너무 쉬움
279,Stickman Hook, 거미처럼 움직여서 재미있어요
280,Stickman Hook, 완전 추천! 250까지 깸!
281,Stickman Hook, 진짜 너무너무 재밌어요^^~
282,Stickman Hook, WOW GOOD
283,Stickman Hook, 너무 재밌어요
284,Stickman Hook, 개꿀 잼
285,Stickman Hook, 광고 극협
286,Stickman Hook, 민혁 성열
287,Stickman Hook, 재미있다.
288,Stickman Hook, 거임을 잘 만드셨어요.
289,Stickman Hook, 저희 동생이 더 잘해요.
290,Stickman Hook, 이 게임 꼭!!! 하세요!! 엽기입니다
291,Stickman Hook, 꼭 한 번씩 해 보세요!!!
292,Stickman Hook, 최고야~
293,Stickman Hook, 재미임 허용. 한번 하면. 빠져듦
294,Stickman Hook, 중독성 짱👍
295,Stickman Hook, 너무 쉽고 재미있어요
296,Stickman Hook, 아주 재미있습니다!
297,Stickman Hook, 현재까지의 최고
298,Stickman Hook, 이 게임 지존입니다
299,Stickman Hook, 광고가 많이 나온다
300,Stickman Hook, 간단하면서도 재미있다.
301,Stickman Hook, 꿀잼ㅋㅋ
302,Stickman Hook, 꿀 잼
303,Stickman Hook, 초고최고.저어어엉말따봉 !!!'!'
304,Stickman Hook, 정말 최고예요
305,Stickman Hook, 재밌는 게이이네요
306,Stickman Hook, 왠지 재미있음
307,Stickman Hook, 갓겜
308,Stickman Hook, 짱
309,Stickman Hook, 꿀 잼
310,Stickman Hook, 꿀 잼
311,Stickman Hook, 광고 너무 많아요
312,Stickman Hook, 아주 재미있어요
313,Stickman Hook, 아주 좋아요
314,Stickman Hook, 재미짐
315,Stickman Hook, ☆☆☆☆☆☆☆☆☆☆☆☆☆☆
316,Stickman Hook, 너무너무 재미있어요
317,Stickman Hook, 대박
318,Stickman Hook, 짱
319,Stickman Hook, Good
320,Stickman Hook, 잼
321,Stickman Hook, 갓겜
322,Stickman Hook, 짱
323,Stickman Hook, 꿀 잼
324,Stickman Hook, 재밌네
325,Stickman Hook, 존잼
326,Stickman Hook, 꿀 잼
327,Stickman Hook, 잼
328,Stickman Hook, 꿀 잼
329,Stickman Hook, 꿀 잼
330,Stickman Hook, 꿀 잼
331,Stickman Hook, 꿀 잼
332,Stickman Hook, 꿀 잼
333,Stickman Hook, 짱
334,Stickman Hook, GOOD
335,Stickman Hook, 꿀 잼
336,Stickman Hook, 개꿀
337,Stickman Hook, 👍👍👍👍👍👍👍
338,Stickman Hook, 재미있다!~
339,Stickman Hook, 스파이더맨????????
340,Stickman Hook, 좋아요
341,Stickman Hook, 😎
342,Stickman Hook, 재밌음
343,Stickman Hook, 너무 좋아요
344,Stickman Hook, 재미있는 게임
345,Stickman Hook, 나름 괜찮네
346,Stickman Hook, 굳
347,Stickman Hook, 굳
348,Stickman Hook, 굿 👍
349,Stickman Hook, 굿
350,Stickman Hook, 굿
351,Stickman Hook, 굿
352,Stickman Hook, 좋다
353,Stickman Hook, 최고
354,Stickman Hook, 굿
355,Stickman Hook, 꼴 잼^^♡
356,Stickman Hook, 🇰🇷😀
357,Stickman Hook," 안녕하세요 그때, 나는 그 말을 듣고 싶다! 그리고 그다음 날 아침 일찍 일어나서 씻고 자야지 내일 봐요 우리 민건이 민찬이와 뱃속 셋째에게는 최고의 아빠임은 누구도 부정할 수 없는 사실임이 있다 와? ? ㅋ ㅋㅋ ㅋㅋㅋ ㅋ ㅋㅋ ㅋㅋㅋ ㅋㅋ ㅋㅋㅋ ㅋㅋㅋ ㅋㅋㅋ ㅋㅋㅋ, 그 결과, 응답자의 절반 이상이 없는 것으로 알려졌다"
358,Stickman Hook, 정말 정말 급 성장이고 패턴이 거의 다 비슷비슷하네요! 그리고 재미있네요 ㅎㅎ
359,Stickman Hook, 너무너무너무너무 재미있고 참신하고 멋있는 게임이기는 한데 게임에 맵을 좀 다양하게 해주세요 제가 엄청 멀리 왔는데도 게임에 맵 자체가 깨던걸 또 깨는 형식이라 재미가 조금 떨어지는 느낌이네요. 제발 매 좀 다양하고 신선한 걸로 부탁드리겠습니다.
360,Stickman Hook, 좋아요! 꼭 깔아보세요! 안 깔으면 후회가! 별 1000000000000000000000000000000000000000000000000000000000000000000000000000000000000000000000000000000000000000000000000000000000000000000000000000000000000000000000000000000000000000000000000000000000000000000000개♡♡♡
361,Stickman Hook, 이준구 님 아 게임 하나 만드는데도 얼마나 힘든지 알고나 그런 🐶소리를 하고 있는 거예요??? 아무튼 이 게임 정말 재미있습니다.
362,Stickman Hook, 아니 광고가 많으면 와이파이는 끄던가. 그리고 님들이 게임 만들어봐 자기 게임 잘 되게 하려고 광고를 많이 넣지
363,Stickman Hook, 이게 난이도가 올라가는 것 같은데 38단계랑 99단계가 거의 똑같은데 어떻게 된 거죠? 이걸 일으셨다면 왜 그런지 알려주세요
364,Stickman Hook, 너무 감사해요. 이런 게임 만들어주셔서^^
365,Stickman Hook, 정말 너무 재밌어요! 그런대 광고만 없애주시면 더 좋을 것 같아요!
366,Stickman Hook, 줄 타는 게ㅠ너무 재밌고 ㅜ맨날 하는데 처음 할 때 100 찍었어요🎈😍😍
367,Stickman Hook, 이준구 님님이 게임 만들어보세요 얼마나 힘든지 알긴 해요??님이 만든 게임은 이것보다 100배 수준 낫은 게임입니다!!!!
368,Stickman Hook, 악플은 단다는 게 자기가 평가한 걸 올리는 건데 그거 가지고 왜 뭐라 하시는지 모르겠네요 인신공격하는 것도 아니고 이러 이런 점네 개선되면 좋겠다는 건데 그런 것도 안 달면 발전이 없어집니다
369,Stickman Hook, 백날 떠들어봐라 너희들 글 재내가 읽어주나
370,Stickman Hook, 아니 그런데 광고가 너무 많이 나옵니다!
371,Stickman Hook, 캐릭터도 귀엽고 게임도 재미있는데... 광고를 좀 줄여주세요.
372,Stickman Hook, 주라 맨이 하늘을 난다 해보세요 재미를 느길거에요 화가안나요해보새요 공자 예우하세요.!! 😁😄😁😇💝💗💞💗💖💗☕🍨
373,Stickman Hook, 하루 만에 150단계 갔으면 넘나 쉬움
374,Stickman Hook, 제게 보내주시면 것 같은 생각이 많이 많이 하는 등이에요
375,Stickman Hook, 광고 별로 나오지도 않고 재밌기만 한데! 님들 핸드폰이 안 좋은 거임!
376,Stickman Hook, 스파이더맨이 생각이 나네요
377,Stickman Hook, 제작자님 힘내세요 저런 악플러들이 인간이 아니라 그래요 힘내세요!!!
378,Stickman Hook, 하면서 레벨이 올라가는데 똑같은 패턴이네요 다양한 레벨을 올려주시면 좋을 것 같습니다
379,Stickman Hook, 캐릭터를 더 추가해주시면 좋겠어요!:) I hope you can add more characters!:)
380,Stickman Hook, 무섭다는 거 잘못
381,Stickman Hook, 이것들아 와이파이나 데이터 끄고 하면 광고 안 뜨잖아 ;;
382,Stickman Hook, Good!
383,Stickman Hook, ㄴㄱㄷㄴㅂㄱㅂㄴㄱㆍㄱㆍ근거가있어요
384,Stickman Hook, 악플 다는 사람들 님들이 만들어봐
385,Stickman Hook, 재미있지만 광고가 좀 많이 나오는 점만.. 고쳐주세요!
386,Stickman Hook, 너무 재밌어요 담에도 이 게임처럼 재미있는 게임 많이 많이 만들어 주세요~
387,Stickman Hook, Very good god game
388,Stickman Hook, 님들 와파 끄고 하면 광고×
389,Stickman Hook, 레알로 핵잼
390,Stickman Hook, 랜덤 부스터 2 사용자
391,Stickman Hook, 금나재밌주
392,Stickman Hook, 재밌어요 이런 거 좋아하는 타입이라서 꿀 잼이네요.
393,Stickman Hook, 광고가 많이 나오는 거 빼고 다 좋아요!!
394,Stickman Hook, 스파이더맨 캐릭터가 나오면 좋은 거 같아요
395,Stickman Hook, 광고 없애주세요
396,Stickman Hook, 다 좋은데 광고가 너무 많이 나와요
397,Stickman Hook, 이것보다 더 재미있는 건 없을 거예요
398,Stickman Hook, 재밌어요×99999999999
399,Stickman Hook, 말이 필요 없어요 정말 재미있어요
400,Stickman Hook, 재미있어요 그리고 실감이 나요
401,Stickman Hook, 더 많은 단계들이 있었으면 좋겠습니다.
402,Stickman Hook, 멀티플레이도 만듷어 주세요.
403,Stickman Hook, It's very fun (정말 재미있어요)
404,Stickman Hook, 재미있는 게임인 거간아요
405,Stickman Hook, 7격려
406,Stickman Hook, 재일짱
407,Stickman Hook, Very good
408,Stickman Hook, 매우 좋아
409,Stickman Hook, 씹갓겜
410,Stickman Hook, 개 꿀 잼 개 꿀 잼
411,Stickman Hook, 재밌네요
412,Stickman Hook, 은근 재미있네요!
413,Stickman Hook, 굿~~~~~!!!!!!!!! ♡♡♡♡♡♡♡♡♡♡♡♡♡♡♡♡♡♡♡♡♡♡♡ ^^
414,Stickman Hook, 백 점 백 점!!!
415,Stickman Hook, 굿배리굿에에에애엥
416,Stickman Hook, it is very fun!!!!
417,Stickman Hook, 재미있어요!
418,Stickman Hook, 나름 재미있음
419,Stickman Hook, 재미있는 게임입니다
420,Stickman Hook, Wow~~
421,Stickman Hook, 짱
422,Stickman Hook, 개꿀
423,Stickman Hook, 꿀 잼
424,Stickman Hook, 꿀 잼
425,Stickman Hook, 꿀 잼
426,Stickman Hook, 고고
427,Stickman Hook, 꿀 잼
428,Stickman Hook, 꿀 잼
429,Stickman Hook, 짱짱
430,Stickman Hook, 꿀 잼
431,Stickman Hook, 꿀 잼
432,Stickman Hook, ch
433,Stickman Hook, 재밌어요
434,Stickman Hook, 짱
435,Stickman Hook, 👍👍👍👍👍👍👍
436,Stickman Hook, 짱👍
437,Stickman Hook, 너무 좋고 재밌고 또 ....
438,Stickman Hook, 스파이더맨이 된 기분??
439,Stickman Hook, 시간 잘 가네요~~
440,Stickman Hook, 재미있어요.
441,Stickman Hook, 완전히 대박👍
442,Stickman Hook, 굿!!!
443,Stickman Hook, 사랑해요
444,Stickman Hook, 파이팅입니다
445,Stickman Hook, 재미없네요
446,Stickman Hook, 게임 좋습니다
447,Stickman Hook, 굿
448,Stickman Hook, 굿
449,Stickman Hook, 어쩔
450,Stickman Hook, ㅅ ㅌ ㅣ ㅁ ㅐ ㅡ ㄱ ㄴ ♥♥♥♥♥♥♥♥♥♥♥♥♥♥
451,Stickman Hook, 최고👍👍👍
452,Stickman Hook, 굿
453,Stickman Hook, 굿
454,Stickman Hook, 좋아요
455,Stickman Hook, 좋아요
456,Stickman Hook, 최고
457,Stickman Hook, 좋아요
458,Stickman Hook, 👍굿
459,Stickman Hook, 굿.
460,Stickman Hook, ♡♡♡♡♡
461,Stickman Hook, 제작자님 게임이 너무 재미있습니다. 앞으로도 업데이트를 기다리겠습니다♥★(멀티 나오게 해주시면 감사하겠습니다.
462,Stickman Hook, 갓 게임! 중독성 짱!
