,name,review
0,The Room Two, 캐릭터 하나 얻으려고 수만 원을 써야 하는 창렬 한 가챠로 가득한 게임보다 저렴한 가격으로 완결된 게임을 즐기는 것이 당신의 즐거움을 위한 선택이다. 현질 유도 게임보다 훨씬 플레이 경험도 뛰어나다.
1,The Room Two,그럭저럭 퍼즐 좋아하면 재밌게 할 듯. 그래픽에 눈 호강합니다ㅠ 중간중간 무서운 장면도 있긴 한데 그럭저럭할 만해요.  하지만 5단계가 끝이라 너무 서둘러 하다가는 돈 아까울 수 있음. 그래도 단계마다 시간이 좀 걸리니 돈 값어치만큼은 하네요
2,The Room Two,재밌어요! 한국어로 번역 안된 게 좀 아쉽긴 하지만ㅋㅋㅋㅋ대충 다 알아먹겠더라고요.. ᄒᄒ 이제 3 사러 갑니다
3,The Room Two,재밌어요. 1편 해보다가 3편까지 결제해서 다 엔딩 봤어요. 요번에 ios는 2까지 한글화됐던데 안드도 빨리 됐으면 좋겠어요. 정말 재밌습니다.
4,The Room Two,2천 원으로 피시방 가서 오버워치 두 시간 할 바엔 이거 하나 사서 사고력 기르는 게 100배는 더 좋네.............. 팔로 떠납니다
5,The Room Two,한글판도 룸은 다시 구매해야 되는 건가요?? 예전에 이거 영문판 너 룸을 돈 주고받았었는데 한글판 나왔다길래 뭐 그냥 한글판 되겠지 했는데 안 되는 거 같은데... 한글판 너 룸은 다시 돈을 주고받아야 하는 건가요??
6,The Room Two,역시나 다룸 1 때랑 달라진 게 있다면 더 깨야 할 게 많아짐 그리고 아쉬운 점은 힌트가 영어...ㅠㅠ 1은 한국어였는데 2에서는 한국어 지원이 안됨 마지막은 영화급 퀄리티 굳굳
7,The Room Two,방금 엔딩 봤어요 아... 아직도 가슴이 뛰는 것 같아요 정말 시간 가는 줄 모르고 푹 빠져서 두근두근하며 즐겼습니다 진짜 재밌어요! 이제 3 시작해야지
8,The Room Two,고퀄리티 퍼즐 게임 짜임새 있는 구성에 훌륭한 연출! 한글판이 빨리 나왔으면 좋겠네요~
9,The Room Two, 뼈다귀 나올 땐 심장이 좀 뛰더군요~하얗게 밤을 지새웠습니다 ㅎㅎㅎ 2017년 말에 하나 더 나온다던데
10,The Room Two,최고다 말이 필요 없는 3탄까지 날 새서 하게 된다
11,The Room Two,재밌어요 ㅋㅋ 방 탈출 게임 중에 단연 최고네요
12,The Room Two,음  보컬의   게임 다 굳
13,The Room Two,The best 돈 더 받아야 되는 게임입니다.
14,The Room Two,정말 최고임 오랜만에 이런 게임 하네 정말 최고다
15,The Room Two, 상상력 자극 두뇌 자극 꿀 잼이다
16,The Room Two,검색... 이거 왜 검색이 안되는 거죠?
17,The Room Two,꿀 잼!! 번역이 없어서 아쉽지만 눈치껏 할 수 있어요!!
18,The Room Two, 어려웠지만 해볼 만한 퍼즐. 드디어 제대로 방이란 걸 탈출:)
19,The Room Two, 시간 가는 줄  몰랐네요
20,The Room Two, 완전 인생게임 그래픽도 최고인데 스토리도 최고이고 문제도 최고
21,The Room Two,말 필요 없다
22,The Room Two,재밌음 4시간이 금방 지나가네
23,The Room Two, The best game ever ! Worth to try
24,The Room Two,The room Is must have item
25,The Room Two,당연 최고 설명이 필요 없음..
26,The Room Two, 정말 졸잼
27,The Room Two, 긴박한 게임 두 번째!
28,The Room Two,최고 시간 가는 줄 모름.
29,The Room Two,thanks gg
30,The Room Two,최고 죄고 탈출 게임계 최고
31,The Room Two,작살 재밌음 대박
32,The Room Two,강추. 이만 원도 아깝지 않습니다.~^^
33,The Room Two, 짱
34,The Room Two, 최고의 게임
35,The Room Two, 굿.. 그래픽 좋음..
36,The Room Two, 최고
37,The Room Two,최고예요 이런 게임은 처음이에요ㅠㅠㅠ 리뷰도 웬만해서 안 쓰는데 너무 재밌어서 추천하려고 씁니다. 단서도 머리 조금만 쓰면 찾을 수 있고 그래픽도 훌륭해요. 암호 풀 때 억지가 없어서 더 좋았음ㅎㅎ다들 한 번씩 해보시길 ㅠㅠㅠ
38,The Room Two,21세기 최고의 게임! 이 게임은 말하자면 유죄이다. 그냥 말 안 해도 모두가 이해하고 즐기는 최고의 게임! 새 챕터 열릴 때가 조금 무서웠지만 정말 엄청나다. 초등학생이라면 용돈 모아서 편의점에 기프트카드 사세요! 더 이상 말하기 힘들....쀍뛝...내..ㅇ...입..뿛뛟췛쵊
39,The Room Two,※필독 자꾸 게임이 안된다는 분들께 핸드폰 사양 좀 보세요 님들 자꾸 안된다고 하시지 말고 플레이하다 보니 사양이 높은 편이라서 사양 호환성 체크도 하시고요 참고로! 전 갤럭시노트 3입니다 잘 돌아가고 플레이하는데 지장 없습니다 그리고 재미있네요 좀 뭐랄까 미궁의 방 탈출 수수께끼 같은 모험적인 플레이 같네요 최고!
40,The Room Two,진짜 고퀄리티 게임! 비록 하루 만에 다 클리어했지만 (클루를 남발했고^^;) 진짜 긴장감 최고에 재미있는 게임이었습니다.  이번 2탄이 처음이었는데 1탄이랑 3탄도 다운로드 확정입니다!
41,The Room Two,이거 하면 다른 방 탈출 게임이 시시해져요 2500원이 하나도 안 아까운 정도가 아니고 이 퀄리티가 2500원밖에 안 한다니 놀라운 정도예요. 그래픽 퀄리티가 너무 좋아서 그거 감상하는 재미도 쏠쏠했어요. 다 깨고 나니까 끝났다는 게 너무 아쉬워요ㅜㅜ
42,The Room Two,"한편의 영화다 내용과 그에 따른 완성도가 매우 높다. 억지스러운 진행이라든지 뻔한 스토리의 전개가 없어 지루하지가 않았고, 그래픽이나 조작 등 퀄리티가 상당하다. 게임을 하고 나서 마치 한편의 영화를 본듯했다. 최고 몰입도의 게임!!"
43,The Room Two,정말 재미있네요 혹시 계속 cloud와 동기화돼서 문제가 되는 분들은 동기화 옵션 끄고 진행하면 됩니다 저도 그것 땜에 삽질을..
44,The Room Two,재미있었어요 굿굿. 1 해보고 믿고 결제했어요. 반나절 동안 재미있게 했네요. 아쉬운 건 한국어가 안 되어있다는 것?? 1처럼 한국어도 나오면 좋겠어요~
45,The Room Two, 몇 달 전에 갤 5에서 약간 오류가 있었는데 다시 해보니까 고쳐졌어요. 그래서 또 재밌게 플레이했습니다. 진짜 돈 더 줘도 안 아까운 게임. 너무 재밌어요.
46,The Room Two,재밌어요!!! 방 탈출 게임 중에 최고 퀄리티라고 말할  수 있을 것 같아요. 엔딩 보면서 감탄했어요ㅎㅎ 계속 좋은 후속작 만들어주시길~
47,The Room Two,"3은 언제 나오나요? 아주 고대하고 있습니다. 1, 2도 정말 몰입도 최고였어요. 적절히 머리도 쓰고요 ^^좀 더 어렵게 나와도 쾌감 있을 것 같아요."
48,The Room Two,"좋다 스토리의 개연성을 떠나서, 게임 자체가 재밌다. 전편이 상자 하나 가지고 별 짓을 다해서 더 참신하게 느껴지긴 했지만 이번 건 더 넓어짐."
49,The Room Two,룸 1에 이어 플레이합니다 돈이 전혀 아깝지 않은 게임이죠~하지만 한국인이라면 아쉬울 한 가지! 아직 룸 2는 한글화가 안됐네요 ㅋㅋ 게임 특성상 눈치껏 하거나 그렇게 장문의 영어는 아니니 힌트 정도를 읽는 데는 큰 문제는 없지만 그래도 몰입감이 한글에 비해 떨어지는 건 사실이네요... 그래도 별 5개가 아깝지 않은 게임입니다
50,The Room Two,"말도 안 되는 미친 퀄리티 적절한 난이도와 뛰어난 그래픽, 환상적이고 으스스 한 연출력 어느 것 하나 깔게 없는 최고의 게임"
51,The Room Two,"돈값은 확실히 합니다.. 방 탈출, 퍼즐 좋아하는 분이라면 추천합니다. 룸 1은 렉 때문에 못하겠던데 2는 렉도 없이 신선한 내용도 있어서 추천합니다."
52,The Room Two,1 하고 왔는데 최고네요 너무 여기저기 왔다 갔다 해서 귀찮긴 했는데 너무 재밌게 해서 괜찮아욥
53,The Room Two,두말 필요 없다 2천 원으로 즐길 수 있는 최고의 시간이었다. 퀄리티는 무조건 보장. 한글판을 기다려본다
54,The Room Two,꼭 해봐야 해요 고퀄 그래픽에 기하학... 미스터리한 요소가 많아서 적당히 섬뜩했던 거 같아요. 진짜 집중하게 만들어요...!!
55,The Room Two,룸 2에서 드라이버 구하고 나서요 상자 아랫부분 옆으로 젖히는 거 계속 제자리로 돌아오는데 그거 어떡해 고정시키나요
56,The Room Two,최고의 게임!! 돈이 아깝지 않을 만큼 재밌어요ㅎㅎ
57,The Room Two,소름 돋았다. . 돈이  전혀  안 아깝다고 느낀 게임... 어떻게 이런 게임 만들었지... 이어 후..  만 원에  팔아도 살만한 가치가 있는 게임
58,The Room Two,멋진 게임 기존의 방 탈출 게임류와는 비교불허. 힌트 보는 것에 부끄러워하지 말자
59,The Room Two,한마디만 한다면 담 편 나오면 필구 합니다
60,The Room Two,완전 재미남 공략 필요 없음 열심히 기억하고 단어 몇 개 이해하고 물음표 참고해야 하는데... 하ㅡ진짜 힘든 게임 재미는 최고 ㅇㅈ
61,The Room Two,생각보다 훨씬 흥미로움 그래픽이 좋네요. 가끔가다 판타지스럽게 진행되는 것도 좋고요
62,The Room Two,최고 다 완전!! 1편은 노트 5 렉이 심해서 살까 말까 고민했는데 구입하길 잘한 듯 완전 재미있으면 어려워서 공략을 보긴 했지만 그래도 재미있다
63,The Room Two,말이 필요 없음... 맨 처음에 조작법만 조금 익숙해진다면 정말 최고의 게임이 될 것이라 확신함
64,The Room Two,진짜 이런 게임 대박 수능 때보다 더 집중해서 하게 되네요 ㅋㅎㅎㅎㅎ 정말 정말 강추입니다~~~
65,The Room Two,솔직히 깔고 다시 지우니까 정신 차림 겨우 다 껨 브금이 좀 무서웠지만 재미났다
66,The Room Two,룸 3 빨리 주세요.. 안드로이드 차별하시나요? ㅜㅜ
67,The Room Two,한동안 잊고 있었는데... 캬 명작이 뒤를 이어서 태어나는군요        아직 해보지도 않았지만 만점 박고 시작합니다 ㅋㅋ
68,The Room Two,역시 유료 게임이라 그런지 퀄리티가 장난 아니네요 굿굿 한 3일 만에 깬 거 같은데 진짜 재밌었습니다
69,The Room Two,Fantastic game ever I played I want to say that the room series is the best game I have ever played on android device. Thank you for making amazing games. If you guys make any games like these I would never hesitate paying even over 10 bucks!
70,The Room Two,믿고 쓰는 파이어 프루프! 무슨 말이 더 필요합니까  그냥 하세요 개인적으론 123다 합쳐서 5만 원이 넘었어도 질렀을 듯
71,The Room Two,재미나요 지루한 줄 모르고 했네요.
72,The Room Two,여리 이건 금세기 최고에 게임이다 롤만 익히면 못 풀건 하나도 없다 최고다 무조건하세요 안 하는 사람이 손해 ㅋㅋㅋ
73,The Room Two,좀 더 길었으면 ... ㅠㅠ 굿
74,The Room Two,"wow 방 탈출하면서 이렇게 몰입해서 해보긴 처음인 거 같네요. 룸 1, 3 바로 다운로드하렵니다ᄒᄒ"
75,The Room Two, 대박..  스케일 쩜ㅋ 영어가 짧은 난 폰을 여러 번 뿌직일번ㅋ
76,The Room Two,파이어 크룹스 공식 페이스북을 보니 안드로이드 버전 룸 3는 16년도 1월 11일에 나온다네요 한 달쯤 남음
77,The Room Two,말이 필요 없다. 그냥 결제하자. 기가 막힌 게임이네요. 최고임
78,The Room Two,도대체.. 도대체 Room three는 언제 나오는지....... 올 초부터 여름에 나온다고 공지했었는데....
79,The Room Two,꿀 잼 영어를 모르면 스토리는 못 즐기지만 게임 플레이에 지장은 거의 없다.  플레이 타임은 눈치만 있다면 그다지 길진 않다. 그래도 재미있음
80,The Room Two, 이건 정말 최고의 게임!!!!!! 걸작임!!!!!! 영어 모른대 다 깼음ㅋㅋㅋㅋㅋ
81,The Room Two,명불허전 말하기 입 아픕니다. 지르세요 2750원이면 요새 까치 값보다 싼 거 같은데...
82,The Room Two,짧은 감이 없잖아 있지만 강력했다 말이 필요 없다
83,The Room Two,한글 번역 아쉬운 점이 있다면 저거 하나..? 힌트 필요 없이 다 깰 수 있다는 점
84,The Room Two,짱재밋음! 공략 보고했지만 귀신 나올까 봐 놀란 1인
85,The Room Two,정말 끝내주네요 상당한 몰입도를 보여주며 약간만 생각하면 풀릴 정도의 난이도라 즐기기 더욱 좋네요
86,The Room Two,ㅋㅋㅋ 묘한 게임 묘해요 그래픽도 나름 신선함!
87,The Room Two,존잼... 다음 거 언제 나오죠?!ㅠ
88,The Room Two,굳 돈이 안 아까운 게임은 처음!!!
89,The Room Two, 환불 좀 요 영어 몰라서 진행 못하겠어요 I don't know English
90,The Room Two,정말 재미..!! 재밌어서 1편에 이어 이것까지 질렀어요.. 그런데 번역은 언제쯤 나오나요?
91,The Room Two,아 재미나 영어 전혀 못하는데 단어 한두 개로 힌트 얻으며 어렵사리 깼네요 정말 재미나요 룸 3 기다려진다 캬아♡
92,The Room Two,영어 중학교 실력 정도면 신세계 경험합니다 무섭고 클래식하고 세련된 최고의 게임. 별 열 개는 없나요. 다룸 3 구매하러 갑니다.
93,The Room Two,재밌어요 그런데 이번엔 어떤 걸 업데이트 한 거죠? 2백 메가 넘게 잡아먹었는데
94,The Room Two,잘 만들었네요 화면 영상과 디테일이 최고네요 풀 때 억지 같은 이해 안 가는 것도 없고요~
95,The Room Two,2500원...???? 진짜 돈이 아깝지 않다. 이천오백 원 해서 클리어 시간이 짧은가 생각했더니 그것도 아니고 적당한 긴장감에 적당한 난이도에!!! 진짜 개 꿀 잼☆☆☆☆핵 추천합니다 진심
96,The Room Two,닥치고 받으세요 못 깬다고 징징거릴 거면 자신의 딸리는 추리력과 공간지각 능력 등을 탓하라
97,The Room Two,말이 필요 없다 최고!!! 돈이 하나도 아깝지 않은 최고의 방 탈출 게임이다 강추
98,The Room Two,3시간 정도 걸려서 ... 시간이 금방 가버림.. 벌레 챕터가 좀 어려웠음.. ㅠ
99,The Room Two,진짜 소름 돋게 재밌습니다 방 탈출 게임 진짜 명작 ㅋㅋㅋㅋㅋㅋ
100,The Room Two,끄응 재미 땅 넘나 재밌는데 무슨 내용인지 잘 모르겠다 ㅠㅠㅋㅋ
101,The Room Two,무서워 힘들게 탈출 다신 들어가고 싶지 않아
102,The Room Two,핵꿀잼 처음으로 돈 주고 샀는데 후회 안됨
103,The Room Two, 야 진짜 제가 지금까지 한게임 중 2번째로 재밌는 게임이었습니다. 제작자님 최고!
104,The Room Two,3은 언제 안드로이드로 오나요 왜 ios만...ㅠㅠ
105,The Room Two,좋아요 한번 시작하니까 게임에서 손을 놓을 수가 없네요
106,The Room Two,최고임! 말이 필요 없다. 1보다 업그레이드된 난이도와 퀄리티!
107,The Room Two,"나는 보았다. 이것은 게임 그 이상이다. 아직까지도 이 게임을 해보지 못했다면, 그것은 인생을 절반 손해 본 것이다."
108,The Room Two,진심 꿀 잼!! 근데 아직 한글 패치 안됨
109,The Room Two,최고 정말 재미있습니다 이것 때문에 영어공부하고 싶을 정도
110,The Room Two,멋진 대? 이런 추리류 게임 중에는 돈 주고 정말 할만하네
111,The Room Two, 어려워요. 근데 업데이트했는데 새 이브 한 거 다 날아감
112,The Room Two, 한번 잡으면 계속하고있음ㄷㄷ
113,The Room Two,다룸 다 깨고 다룸 2 하러 옴 다룸 챕터 2가 렉이 걸려서 못했지만 이번 건 잘 되겄징?
114,The Room Two,3 안드로이드 빨리 좀... 출시 빨리해주세요 현기증 나니까..
115,The Room Two,최고 가장 재밌게 한 게임 시리즈. 나오는 대로 구매할 수 있습니다.
116,The Room Two,꿀 재미 스팀에서 1을 봤는데 너무 재미져서 구매했는데 역시 꿀 잼
117,The Room Two,와 분위기부터 적절한 난이도에 연출까지... 흠잡을 데 없는 오래간만에 보는 수작임...
118,The Room Two,최고.. 말이 필요 없다 3탄도 나왔으니 무조건 사야 한다
119,The Room Two, 촉수주의+극혐주의+깜놀주의
120,The Room Two,최고임!! 몰입도 짱!!
121,The Room Two,존잼 메시지를 읽을 수 있으면 더 좋겠지만 ㅠ
122,The Room Two,와우 다 껬다 ㅋ
123,The Room Two,형 샀다 살만해
124,The Room Two,개꿀 잼 공포랑 퍼즐이랑 잘 섞임
125,The Room Two,말은 필요하지 않다 구매 실행 클리어
126,The Room Two,굳 강력 추천...
127,The Room Two, 진짜 재미있네요 ㄷㄷ
128,The Room Two,와 미쳤음 ㄷㄷ
129,The Room Two,너무 재밌어요 다룸 3도 나왔으면 좋겠네요♡(I'm expecing for the room 3!!)
130,The Room Two,안드로이드는 다룸 3 언제나 오나요!!! 애틀 스토어는 있더구먼
131,The Room Two,재밌어요! 진짜 돈이 아깝지 않음
132,The Room Two,이거 3  나왔던데 안드로이드로는 언제 나오려나..
133,The Room Two,Beyond description All thumbs up
134,The Room Two,Nice This is the perfect game ever
135,The Room Two,빨리요 3는 언제나 오나요? 빨리ㅎᆞ고 싶습니다
136,The Room Two,와 역대급 꿀 잼 영
137,The Room Two,꿀 잼 핵꿀잼 ㅇㅈ!
138,The Room Two,재미있습니다. 퍼즐 게임 중에 제일 재미있게 했습니다.
139,The Room Two,최고 1편 해보고 2 편해 보고 3편 지릅니다
140,The Room Two,최고의 게임 최고의 게임.. 이 정도로 완성도 높은 게임은 아직 못 봤다.
141,The Room Two,최곱니다 한글 번역이 빨리 됐으면 좋겠군요
142,The Room Two,별 5개 받아야 마땅합니다.
143,The Room Two,개면 작 꼭 해보세요
144,The Room Two,재밌음 3 받으러 갑니다
145,The Room Two,허니잼 진짜 재밌음
146,The Room Two,두 번 사세요 세 번 사세요! !
147,The Room Two,최고의 게임 퀴즈 게임류 중에서 최고의 게임이다. 비교할 비슷한 게임조차 떠오르지 않는다.
148,The Room Two,내 생애 최고의 방 탈출 게임! 설명이 필요 없다!
149,The Room Two,좋아요 재미남 ㅋㅋㅋ
150,The Room Two,레전드 No need explanation. The best game series ever.
151,The Room Two,두근두근 명불허전 다룸
152,The Room Two,대박 흥미진진합니다 진심으로..
153,The Room Two, 꿀 잼!!
154,The Room Two,존잼 집중력짱 재미남 한국어 버전 필요해요
155,The Room Two,너무 좋아 재밌음
156,The Room Two,말 필요 없죠 다들  아시죠?? 재밌는 거
157,The Room Two,최고! 3탄 빨리 나왔으면 좋겠어요
158,The Room Two,소름 최고 최고  겁나 재밌게 했어요
159,The Room Two,최고예요 존잼 쮸벌 3 언제 나옵니까 빨리 좀요...
160,The Room Two,개꿀 잼 진짜 재밌어요 대박임
161,The Room Two, 몇 번을 다시 해도 질리지 않음
162,The Room Two,말이 필요 없다!! 정말이시대 최고의 게임!!
163,The Room Two,최고입니다 정말 재밌습니다
164,The Room Two,최고의 게임 two thumbs up
165,The Room Two, 인생게임
166,The Room Two,Coooool!!! Remarkable!! Need to play Room 3
167,The Room Two, 이건 그냥 최고 게임
168,The Room Two,지림 그냥 지림
169,The Room Two,말이 필요 없음 제목 그대로.
170,The Room Two,정말 굿해보시면 알게 돼요 ^^
171,The Room Two, 가격 대비 짱입니다
172,The Room Two, 정말 잘 만든 게임
173,The Room Two,짧지만 강하네
174,The Room Two, 잘 만든 어드벤처게임
175,The Room Two,대박 입체감 최고!
176,The Room Two,쩌네.. 퀄리티 쩌네..
177,The Room Two,최고 ㅇㅁㅇbbbbbbbbbb
178,The Room Two,재미 만점 해보세요
179,The Room Two, 넘나 재미난 것
180,The Room Two,게 아네 최고
181,The Room Two, 와 정말 재밌다
182,The Room Two, 굿 잼
183,The Room Two, 개꿀
184,The Room Two, 꿀 잼
185,The Room Two, Excellent
186,The Room Two,빨리 3 나왔으면... 진짜 꿀 잼... 최고
187,The Room Two,잼 따 잼 따
188,The Room Two,꿀 잼 꿀 잼
189,The Room Two,짱 짱
190,The Room Two,★★★★★ 플레이하는 내내 즐거웠습니다~!
191,The Room Two,최고 gooooooooood
192,The Room Two,와 재밌다
193,The Room Two,굿 꿀 잼
194,The Room Two,최고 존잼
195,The Room Two,굿. 굿굿.
196,The Room Two, Best
197,The Room Two,굿 굿
198,The Room Two,굿굿 굿굿
199,The Room Two,"최고.. ""The Room One""에 이은 ""The Room Two"" .... 말이 필요 없는 듯... 1이랑 비슷하다? 천만의 말씀... 1은 특정한 사물 하나로 다루었다면 2는 공간에 있는 여러 물건들을 다루었음 ...!! (공략집은 절대 보지 말 것!!!!)(이어폰 끼고 하는 거 강추... (소리가 아주 생생함.. 덕분에 몰입도 최고!!)) 저렴한 가격에 고퀄의 게임은 찾아보기도 힘듦.. 근데 여깄음!!! 꼭!! 꼭!! 한 번이라도 플레이 고고!!!"
200,The Room Two,어머나 세상에 퍼즐을 맞추듯이 하나하나 해결해가며 스테이지 깨는 걸 좋아하는 사람들에겐 적극 추천. 정말 하나하나 이어가듯이 힌트나 오는 게 소름 끼칠 정도로 잘 만들었고 시간 가는 줄도 모르게 재밌음 (엔딩은 약간 아쉽...)
201,The Room Two,"신세계가 펼쳐집니다. 정말 모바일 게임에서 이런 퀄리티와 정성이 느껴지는 작품이 나왔다는 게, 플레이 내내 느껴집니다. 정말 감탄의 연속입니다. 난이도는 약간 어렵지만 그렇다고 아예 못 할 정도는 아니고 딱 적당합니다. 단연 최고."
202,The Room Two,챕터 2 중간에 진행이 안됩니다 편지 보고 지도에서 방향 바꿔서 코인 옮기는데 첫 번째는 되고 두 번째가 안됩니다 게임 삭제했다 다시 해봤는데 같은 곳에서 안되네요 어떻게 해야 하나요?
203,The Room Two,말이 필요 없음 퍼즐 풀기 좋아하는 분들에게는 진짜 최고의 게임이네요... 돈 하나도 안 아깝고 오히려 너무 저렴하다는 생각이 들 정도 .. ㅋㅋ
204,The Room Two,정말 최고네요 마지막엔 어려워서 좀 짜증도 났었는데 풀고 나서는 최고.. 와.. 진짜 최고..를 연발했네요 분위기가 조금 으스스하지만 그만큼 스릴 있고 재미있어요 유료 게임 처음 해보는데 3탄도 기다리겠습니다!
205,The Room Two,"최고의 퍼즐게임입니다. 게임하는 동안 몰입도가 장난아니네요ㄷㄷ 분위기도 으스스한 게 스릴감(?)도 있고, 난이도도 딱 적당한 거 같네요ㅎㅎ 하지만 1편보다는 길어졌긴 하지만, 그래도 끝내고 나니 조금 아쉬운 감이 없진 않네요.. 3편 기대합니다~♡"
206,The Room Two,진짜 재밌네요... 돈이 전혀 아깝지 않고 너무 싸다 싶을 정도입니다 정말 재밌어요! 분위기가 좀 무섭긴 하지만요..
207,The Room Two,와우 처음엔 무슨 게임이 이래...  했는데 하면 할수록 이런 대단한 게임은 두 번 다시 나올 수 없다는 생각이 들게 만드는 게임이네요. 크리스마스 시즌에 할인된 가격으로 구매했는데 이런 게임이라는 걸 알았다면 세일하지 않아도 필히 구매했을 것 같네요.  정말이지 말이 필요 없는 게임입니다.  강추해요.
208,The Room Two,와.... 진심 질린다... 꼭 하세요 두 번 하세요.. 돈 낸 게 정말 안 아까움... 진심 그래픽 효과 지리고 기믹..쩔어용 꼭 해보세요! 난이도도 그리 어렵지도 않아서 가끔씩 너무 어려울 땐 공략 보고하시면 충분하실듯 합니다ㅎㅎ
209,The Room Two,재미있습니다 생각보다 에피소드가 많지 않지만 확실히 돈이 아깝지 않아요 ㅋㅋㅋ 룸 3가 혹시 나오면 또 지를지도...
210,The Room Two,깔끔한 두뇌게임 과하지도 않고 아주 쉽지도 않아 좋았음. 10편까지는 나오겠죠? 다소 짧은 게 아쉬움
211,The Room Two,재밌어요 몰입도 최고. 뒤가 궁금해서 손을 뗄 수가 없어요. 아~ 너무 오래 했더니 고개 아파. ㅠㅠ
212,The Room Two,꿀 잼. 제작진에 찬사를... 룸 원을 처음 했을 땐 기존의 복잡한 계산형 escape 게임들과 조금 달라서 헤맸던 기억이 있는데요.. 룸 투 크리스마스 할인 뜨길래 망설임 없이 바로 구매했습니다. 진짜 돈 안 아까운 게임! 크리스마스이브 저녁부터 자기 전에 조금씩 해서 오늘 엔딩 봤네요~ 짱짱. 멋져요.
213,The Room Two,진짜 꿀 잼 힌트다 영어라서 힘들긴 한데 진짜 안 깨질 때는 공략 보면 되고 G6나 꼬집어 말할 수 없지만 웬만한 게임들보다 나은 거 같음 천 원이면 진짜 거저다.. 돈 안 아까움
214,The Room Two,매우 재미있게 플레이 퍼즐 하나하나 잘만 둘었고 그래픽도 좋아요. 그리고 마지막 엔딩 영상에서 너무 인상적이어서 계속 플레이하게 되네요 약간 무서웠지만...
215,The Room Two,ㅠㅠ 꿀 잼이에요 올해 3 나온다 했던 거 같아서 3 기다리면서 오랜만에 다시 플레이했네요! 재미 써 욥
216,The Room Two,최고입니다 웬만해서 무료를 하지만 댓 보고 마음먹고 받았는데 후회를 하지 않았습니다 좀 아쉬운 건 퀄리티가 최고급이지만 스토리가 짧아서 좀 더하고 싶은데 아쉬운 느낌이 듭니다 동영상 찍어서 블로그에 올려야지♡
217,The Room Two,진짜 돈이 전혀 아깝지 않습니다 다룸 1과도 비슷하다고 말씀하시지만 솔직히 확실히 다릅니다. 더 넓고 더 어렵게 되어있고요 보는 재미도 쏠쏠합니다
